number;id;comments;title;createdAt;closedAt
3062;MDU6SXNzdWU0MTM0OTE3OA==;{'totalCount': 2};Tab completion fails for global aliases;2014-08-28T02:07:40Z;2018-06-12T22:07:20Z
3074;MDU6SXNzdWU0MTYxMTgzMA==;{'totalCount': 2};after update i have error: ;2014-09-01T06:56:42Z;2014-09-01T08:02:48Z
3079;MDU6SXNzdWU0MTczMjE5Mg==;{'totalCount': 9};Cygwin upgrade_oh_my_zsh broken;2014-09-02T17:10:18Z;2014-09-29T20:16:35Z
3080;MDU6SXNzdWU0MTczOTY3MA==;{'totalCount': 1};Ran recent update and get prompt_setup_pygmalion error;2014-09-02T18:30:31Z;2014-09-02T18:34:11Z
3088;MDU6SXNzdWU0MTgwOTg0Mg==;{'totalCount': 7};Pygmalion Broken: add-zsh-hook missing after upgrade;2014-09-03T12:19:23Z;2014-09-03T14:40:52Z
3093;MDU6SXNzdWU0MTg2NjQ1NQ==;{'totalCount': 7};rbenv plugin not working with homebrew;2014-09-03T20:51:37Z;2019-05-08T07:51:06Z
3094;MDU6SXNzdWU0MTg5NjEzNw==;{'totalCount': 12};git completion not working in tmux;2014-09-04T05:24:35Z;2015-02-05T09:12:49Z
3096;MDU6SXNzdWU0MTk0MTA3Mw==;{'totalCount': 3};Images broken in themes wiki;2014-09-04T14:08:55Z;2015-06-05T15:02:18Z
3100;MDU6SXNzdWU0MjA2MzI1OA==;{'totalCount': 8};aws completion broken in latest release;2014-09-05T16:17:27Z;2014-11-18T00:09:58Z
3102;MDU6SXNzdWU0MjExNDkwNA==;{'totalCount': 6};Getting error message when making ZSH default shell in Ubuntu 14.04;2014-09-06T11:41:02Z;2014-11-05T20:11:45Z
3111;MDU6SXNzdWU0MjE2Mzk0MA==;{'totalCount': 5};Compatibility with bash;2014-09-08T04:38:48Z;2014-09-16T13:21:20Z
3115;MDU6SXNzdWU0MjI5ODczMQ==;{'totalCount': 2};Plugin for syntax highlighting;2014-09-09T12:04:54Z;2014-09-14T04:00:38Z
3116;MDU6SXNzdWU0MjMxNTcyNg==;{'totalCount': 0};Autocomplete stopped working for the plugins;2014-09-09T15:00:35Z;2014-09-09T16:11:34Z
3124;MDU6SXNzdWU0MjU5Njc3Nw==;{'totalCount': 3};Install separately?;2014-09-12T05:07:07Z;2014-09-12T14:06:57Z
3126;MDU6SXNzdWU0MjYzNTQyMw==;{'totalCount': 1};parse_git_dirty() always returns dirty if branch = 1 on .gitconfig;2014-09-12T14:36:55Z;2014-09-13T16:32:29Z
3129;MDU6SXNzdWU0MjY4NTE5MA==;{'totalCount': 12};path/to/.oh-my-zsh/plugins/git/git.plugin.zsh:87: command not found: compdef;2014-09-13T02:34:54Z;2015-10-20T17:30:24Z
3130;MDU6SXNzdWU0MjY4NzAyNQ==;{'totalCount': 2};"Ubuntu 14.04 .zshrc: Syntax error: ""("" unexpected straight after the installation";2014-09-13T04:45:25Z;2014-09-13T15:43:56Z
3134;MDU6SXNzdWU0MjcwNjU1Nw==;{'totalCount': 12};_current_epoch:1: command not found: date ... on start;2014-09-13T21:48:57Z;2014-09-16T22:13:58Z
3137;MDU6SXNzdWU0MjcyMzQ5Nw==;{'totalCount': 4};default code style;2014-09-14T15:50:28Z;2015-03-29T23:21:00Z
3149;MDU6SXNzdWU0MjkzNzE5OQ==;{'totalCount': 2};Warning for `rm -rf ~`;2014-09-16T21:43:09Z;2015-12-13T23:25:03Z
3154;MDU6SXNzdWU0MzA1MDc4Mw==;{'totalCount': 2};AWS plugin overrides any theme's RPROMPT;2014-09-17T19:07:52Z;2014-09-17T20:06:25Z
3161;MDU6SXNzdWU0MzI2MjEwNQ==;{'totalCount': 2};"Autocomplete returning ""awk: invalid -v option"" ";2014-09-19T17:26:19Z;2014-09-20T03:35:05Z
3162;MDU6SXNzdWU0MzI3NTM0Nw==;{'totalCount': 5};Unexpected message when i login as  a root ;2014-09-19T19:49:14Z;2014-10-13T13:30:40Z
3163;MDU6SXNzdWU0MzMwOTQ0OA==;{'totalCount': 9};login: -zsh: Permission denied;2014-09-20T12:41:13Z;2014-10-13T13:30:27Z
3168;MDU6SXNzdWU0MzY0NjE1MA==;{'totalCount': 2};Why `export PATH` and not `typeset -U path`?;2014-09-23T15:46:23Z;2014-10-02T04:47:30Z
3169;MDU6SXNzdWU0MzY3MTM3MA==;{'totalCount': 3};wd plugin fails with spaces in folder names;2014-09-23T19:18:56Z;2014-11-06T17:28:08Z
3170;MDU6SXNzdWU0MzY4NzU0Nw==;{'totalCount': 0};gitignore plugin gives permanently removed response;2014-09-23T21:37:34Z;2014-09-24T19:45:56Z
3174;MDU6SXNzdWU0Mzg4NTc0Nw==;{'totalCount': 2};It seems like new bash bug works on zsh too.;2014-09-25T08:19:58Z;2014-09-25T08:34:24Z
3175;MDU6SXNzdWU0MzkxMDkwOQ==;{'totalCount': 2};Using ohmyzsh with muse theme shows no text-input in screen;2014-09-25T12:01:14Z;2014-09-29T20:45:20Z
3176;MDU6SXNzdWU0Mzk0Mjg0MA==;{'totalCount': 11};Is Oh My Zsh affected by #shellshock?;2014-09-25T17:06:12Z;2015-02-10T19:22:03Z
3179;MDU6SXNzdWU0NDEyMjI3NQ==;{'totalCount': 1};the robbyrussell theme can not make difference between root and normal users;2014-09-27T01:24:41Z;2015-06-05T15:02:18Z
3181;MDU6SXNzdWU0NDI4NTQ2NQ==;{'totalCount': 2};yum install name.rpm can not auto complete;2014-09-29T12:00:35Z;2018-04-15T19:49:08Z
3190;MDU6SXNzdWU0NDg4OTgyOA==;{'totalCount': 12};ugly appearance in emacs shell on  Mac osx ;2014-10-04T18:00:31Z;2015-06-05T15:02:18Z
3192;MDU6SXNzdWU0NDkzNjUxMA==;{'totalCount': 2};How to create new tmux sessions with ZSH_TMUX_AUTOSTART=true?;2014-10-06T01:01:25Z;2014-11-21T08:59:46Z
3207;MDU6SXNzdWU0NTUzNjg5MQ==;{'totalCount': 8};Download the install script with a secured connection;2014-10-11T01:01:45Z;2015-06-05T15:02:18Z
3208;MDU6SXNzdWU0NTU0NDA1OQ==;{'totalCount': 6};"Warp point should not contain whitespace while is just  contains ""s""";2014-10-11T07:02:05Z;2015-06-05T15:02:19Z
3209;MDU6SXNzdWU0NTU0NDEzMw==;{'totalCount': 8};docker autocomplete ?;2014-10-11T07:05:54Z;2014-10-17T07:25:14Z
3219;MDU6SXNzdWU0NTcwODkxOQ==;{'totalCount': 6};Special symbols can't display properly.;2014-10-14T03:34:44Z;2014-10-21T01:45:06Z
3221;MDU6SXNzdWU0NTc1MjEyOQ==;{'totalCount': 1};gitstatus.py incorrectly parse git status for some config;2014-10-14T13:51:02Z;2014-10-14T18:34:48Z
3227;MDU6SXNzdWU0NTg5ODQxOA==;{'totalCount': 17};git completions break when current working path contains spaces;2014-10-15T17:58:43Z;2015-03-22T10:12:42Z
3229;MDU6SXNzdWU0NTk3NDU0Nw==;{'totalCount': 1};I typed ssh + <space>+<Tab>+<Tab>,it is not come out `ssh root@112.112.112.112` like this command;2014-10-16T11:20:16Z;2015-02-24T08:45:36Z
3233;MDU6SXNzdWU0NjE4OTQyNQ==;{'totalCount': 13};How do I know if oh-my-zsh is running?;2014-10-18T22:29:31Z;2015-02-22T01:07:01Z
3234;MDU6SXNzdWU0NjE5NDM0MA==;{'totalCount': 3};compleat plugin not working;2014-10-19T03:17:18Z;2019-04-04T21:55:11Z
3235;MDU6SXNzdWU0NjE5OTYzMQ==;{'totalCount': 1};jump completion does not work on yosemite aka 10.10;2014-10-19T08:05:52Z;2020-02-11T18:42:01Z
3236;MDU6SXNzdWU0NjIwMTI0MQ==;{'totalCount': 7};iwhois:3: command not found: whois;2014-10-19T09:49:10Z;2014-10-19T16:11:25Z
3238;MDU6SXNzdWU0NjIyMjQ4OA==;{'totalCount': 5};Shell prompts break and show RVM_PROJECT_PATH when used with rvm;2014-10-20T00:12:35Z;2014-10-22T15:00:49Z
3246;MDU6SXNzdWU0NjM0OTM5OA==;{'totalCount': 1};update wd plugin to play nice with OS X Mavericks;2014-10-21T02:53:01Z;2015-06-05T15:02:19Z
3247;MDU6SXNzdWU0NjM2MTQ2MQ==;{'totalCount': 4};Yosemite's zsh CPU process at 100%;2014-10-21T07:08:20Z;2014-10-22T04:21:37Z
3250;MDU6SXNzdWU0NjQyNzk0MQ==;{'totalCount': 2};Yosemite upgrade messig with icon characters;2014-10-21T18:33:17Z;2014-10-28T00:57:36Z
3253;MDU6SXNzdWU0NjUzODYyNA==;{'totalCount': 2};Update check script hangs, leaks memory;2014-10-22T17:44:32Z;2014-10-22T18:48:25Z
3255;MDU6SXNzdWU0NjU1NTMwNQ==;{'totalCount': 6};Yosemite broken zsh?;2014-10-22T20:18:21Z;2014-11-24T11:38:59Z
3262;MDU6SXNzdWU0NjcyNTExNA==;{'totalCount': 7};who can tell me which is the theme on the homepage of  http://ohmyz.sh/ ?;2014-10-24T10:37:56Z;2014-10-29T06:30:29Z
3264;MDU6SXNzdWU0NjgyNTEzMg==;{'totalCount': 2};bad location of Z-Shell in scripts;2014-10-25T22:12:47Z;2014-10-30T12:41:59Z
3266;MDU6SXNzdWU0Njk5NTY4NA==;{'totalCount': 9};"For the theme ""ys""";2014-10-28T07:05:05Z;2015-02-23T07:34:28Z
3267;MDU6SXNzdWU0NzA3MzQ2OA==;{'totalCount': 9};Screenshots for each theme;2014-10-28T19:56:21Z;2018-06-15T21:25:28Z
3269;MDU6SXNzdWU0NzEwMzY5MA==;{'totalCount': 10};Can I change zsh to default shell when zsh is installed without root privilege?;2014-10-29T02:06:47Z;2014-10-31T23:56:08Z
3271;MDU6SXNzdWU0NzEzMTA0OQ==;{'totalCount': 5};ps1_fortune:2: command not found: fortune , use random theme;2014-10-29T10:21:50Z;2014-10-29T10:24:09Z
3272;MDU6SXNzdWU0NzEzNDA2NQ==;{'totalCount': 3};gcp executable collides with git cherrypick on autocomplete;2014-10-29T10:55:33Z;2014-10-30T22:51:50Z
3273;MDU6SXNzdWU0NzE0ODQwNQ==;{'totalCount': 4};Running source kvm.sh crashes with zsh but works with bash;2014-10-29T13:35:27Z;2014-10-29T17:31:03Z
3276;MDU6SXNzdWU0NzIzNzEyNg==;{'totalCount': 3};duplicate alias in git.plugin;2014-10-30T06:14:34Z;2015-06-05T15:01:32Z
3277;MDU6SXNzdWU0NzI0ODY2NQ==;{'totalCount': 3};Update: don't prompt the first time zsh starts;2014-10-30T09:30:26Z;2018-06-15T21:56:43Z
3282;MDU6SXNzdWU0NzU1Mzc4NQ==;{'totalCount': 6};Load custom configs from $ZSH_CUSTOM before loading plugins defined in ~/.zshrc?;2014-11-02T23:49:30Z;2015-07-10T00:20:33Z
3284;MDU6SXNzdWU0NzYwNzUwMA==;{'totalCount': 6};Disable git-prompt based on path?;2014-11-03T15:42:55Z;2016-01-21T14:03:59Z
3285;MDU6SXNzdWU0NzYyMDk0Mg==;{'totalCount': 2};"""apt-get download"" won't complete";2014-11-03T17:31:37Z;2015-06-05T15:02:19Z
3286;MDU6SXNzdWU0NzYyMTQ3NQ==;{'totalCount': 3};New commands don't completing;2014-11-03T17:36:28Z;2014-11-03T19:14:42Z
3287;MDU6SXNzdWU0NzYyMjc2Nw==;{'totalCount': 1};Esc don't escape on tab completion menus;2014-11-03T17:48:51Z;2014-11-03T19:17:19Z
3288;MDU6SXNzdWU0NzY1ODk1MA==;{'totalCount': 15};How to turn off git plugin;2014-11-03T23:26:24Z;2015-06-05T15:02:19Z
3291;MDU6SXNzdWU0Nzc5NTkwMw==;{'totalCount': 16};Permission denied when accessing .zshrc;2014-11-05T03:30:34Z;2014-11-06T18:31:01Z
3292;MDU6SXNzdWU0NzgwMDQwMw==;{'totalCount': 2};Can't have custom themes;2014-11-05T05:12:12Z;2014-11-05T14:30:12Z
3294;MDU6SXNzdWU0NzkyNjU5Nw==;{'totalCount': 10};Install syntax error;2014-11-06T06:02:56Z;2014-11-25T07:13:04Z
3295;MDU6SXNzdWU0NzkyOTI4OA==;{'totalCount': 2};git autocomplete returns an error while trying to complete file name ;2014-11-06T06:50:35Z;2014-11-09T02:01:03Z
3300;MDU6SXNzdWU0ODExNzQ1Mw==;{'totalCount': 7};"Check to see whether zsh is installed before ""chsh -s `which zsh`""";2014-11-07T18:56:57Z;2015-08-31T04:44:38Z
3304;MDU6SXNzdWU0ODE5NDU3NQ==;{'totalCount': 15};code breaks;2014-11-09T07:38:45Z;2014-11-09T08:44:29Z
3305;MDU6SXNzdWU0ODI1MTg0MA==;{'totalCount': 7};'e' command do not open emcas;2014-11-10T10:50:03Z;2019-02-13T19:21:46Z
3308;MDU6SXNzdWU0ODM5NDU4MA==;{'totalCount': 3};when terminal closes the created alias are lost;2014-11-11T15:16:21Z;2015-02-22T03:47:59Z
3317;MDU6SXNzdWU0ODU3MzQ5Ng==;{'totalCount': 4};oh my zsh fresh install issue syntax error line 48 plugins=(git);2014-11-12T22:45:06Z;2015-10-21T09:20:34Z
3319;MDU6SXNzdWU0ODY1NzAyOQ==;{'totalCount': 2};ZSH plugin, for Git repo folder switching, management and cloning;2014-11-13T16:25:46Z;2018-06-12T20:13:57Z
3325;MDU6SXNzdWU0ODkzMjg2Nw==;{'totalCount': 11};Cursor shows one character behind;2014-11-15T21:13:34Z;2015-06-05T15:02:19Z
3327;MDU6SXNzdWU0OTE0OTIxNA==;{'totalCount': 19};Many of the theme's screenshots not showing;2014-11-17T21:42:35Z;2015-04-05T23:05:38Z
3330;MDU6SXNzdWU0OTI2NTE5MA==;{'totalCount': 1};Extra characters on prompt inside byobu/tmux session (Mac OS);2014-11-18T17:26:27Z;2014-11-18T17:45:21Z
3331;MDU6SXNzdWU0OTM0MTYyOQ==;{'totalCount': 14};Error beeps and echoing of the last command in ZOC;2014-11-19T07:22:18Z;2016-01-18T14:19:29Z
3332;MDU6SXNzdWU0OTQwNDA1NA==;{'totalCount': 3};`pj` is broken since last change;2014-11-19T15:06:36Z;2014-11-20T07:24:56Z
3336;MDU6SXNzdWU0OTc1Mjg5MA==;{'totalCount': 5};Aptitude ;2014-11-21T21:52:34Z;2014-11-23T12:18:26Z
3340;MDU6SXNzdWU0OTg4MDY3Nw==;{'totalCount': 2};GREP_OPTIONS is deprecated;2014-11-24T11:41:13Z;2014-11-25T12:19:44Z
3343;MDU6SXNzdWU1MDAyMjY3OA==;{'totalCount': 2};GREP_OPTIONS is depricated since ~grep 2.20;2014-11-25T12:59:33Z;2014-12-15T00:31:54Z
3345;MDU6SXNzdWU1MDE5NjU5MA==;{'totalCount': 8};Problem with tmux plugin and Fedora 20;2014-11-26T16:07:35Z;2018-08-03T20:39:10Z
3346;MDU6SXNzdWU1MDIwNTY4MQ==;{'totalCount': 5};Completion is repeated after sudo -s;2014-11-26T17:23:47Z;2015-06-05T15:02:19Z
3348;MDU6SXNzdWU1MDIxNTY0Mg==;{'totalCount': 4};theme-and-appearance.zsh messing with `ls` settings;2014-11-26T19:02:33Z;2014-11-27T11:26:22Z
3350;MDU6SXNzdWU1MDI0ODIyOA==;{'totalCount': 6};can't use tab autocomplete;2014-11-27T02:33:24Z;2015-10-18T14:11:06Z
3351;MDU6SXNzdWU1MDM0NzA5Nw==;{'totalCount': 5};Large delay when running commands inside a git-svn directory;2014-11-28T07:12:58Z;2015-02-21T07:44:57Z
3355;MDU6SXNzdWU1MDQwMjc3NA==;{'totalCount': 3};About Ubuntu Linux Theme;2014-11-28T20:52:50Z;2015-04-08T05:43:20Z
3356;MDU6SXNzdWU1MDQxMTI2Mw==;{'totalCount': 21};complete:13: command not found: compdef;2014-11-29T01:25:52Z;2015-06-05T15:02:19Z
3360;MDU6SXNzdWU1MDQ4MDA0MA==;{'totalCount': 10};First-time users run into `chsh: option requires an argument -- 's'`;2014-12-01T01:45:11Z;2015-06-05T15:02:19Z
3361;MDU6SXNzdWU1MDQ4MDc2Nw==;{'totalCount': 1};HISTSIZE and SAVEHIST get clobbered if user already has them set;2014-12-01T02:04:52Z;2014-12-15T00:34:14Z
3363;MDU6SXNzdWU1MDU1NDAzOA==;{'totalCount': 6};git plugin: allow to skip (possibly setup) git wrapper function (e.g. `hub`);2014-12-01T17:58:12Z;2015-11-08T11:28:25Z
3367;MDU6SXNzdWU1MDcwOTYxNA==;{'totalCount': 21};Installation fails on BSD;2014-12-02T19:55:47Z;2015-08-30T16:13:04Z
3368;MDU6SXNzdWU1MDgwODEzMg==;{'totalCount': 4};two repeated characters before command when using tab completion;2014-12-03T09:26:19Z;2014-12-04T16:01:14Z
3370;MDU6SXNzdWU1MDg3NDU5MQ==;{'totalCount': 1};Order dependency between bundler and rails plugins;2014-12-03T18:36:41Z;2015-06-05T15:02:19Z
3377;MDU6SXNzdWU1MTA4NjI2MA==;{'totalCount': 3};Symfony2 plugin breaks path completions in arguments;2014-12-05T10:55:46Z;2018-04-15T19:54:58Z
3379;MDU6SXNzdWU1MTE0NzY3NQ==;{'totalCount': 5};Feature request: split plugins into submodules;2014-12-05T21:24:23Z;2015-06-05T15:02:19Z
3381;MDU6SXNzdWU1MTE5Mjg3Mg==;{'totalCount': 1};New versions of grep complain about GREP_OPTIONS being deprecated;2014-12-06T19:20:29Z;2014-12-06T19:22:56Z
3384;MDU6SXNzdWU1MTIxNjEzMg==;{'totalCount': 1};encoding problem on OSX;2014-12-07T12:15:11Z;2015-06-05T15:02:19Z
3385;MDU6SXNzdWU1MTIyNjA5Nw==;{'totalCount': 6};Comment is not recognized;2014-12-07T18:23:21Z;2015-07-09T20:23:56Z
3390;MDU6SXNzdWU1MTU2ODI5MA==;{'totalCount': 2};Symfony2 plugin stopped working since v2.6.0-BETA1;2014-12-10T15:07:12Z;2014-12-16T09:37:45Z
3392;MDU6SXNzdWU1MTYxMDczMA==;{'totalCount': 7};npm plugin slows terminal startup on osx;2014-12-10T21:03:00Z;2018-06-12T20:57:08Z
3396;MDU6SXNzdWU1MTc1MjE4Mg==;{'totalCount': 7};Completion moves the current line up deleting older command output ;2014-12-11T23:24:16Z;2019-04-07T13:12:23Z
3398;MDU6SXNzdWU1MTg1ODM2OA==;{'totalCount': 2};Facing the job table full or recursion limit exceeded issue;2014-12-12T22:02:57Z;2015-06-05T15:02:19Z
3411;MDU6SXNzdWU1MjAxMTM4MA==;{'totalCount': 2};Should ~/.profile be sourced (indirectly) from ~/.zshrc?;2014-12-15T17:02:57Z;2014-12-20T04:31:49Z
3414;MDU6SXNzdWU1MjA2MjA0MA==;{'totalCount': 2};Change screen plugin to show more info when using vim;2014-12-16T01:22:21Z;2014-12-17T11:55:55Z
3416;MDU6SXNzdWU1MjA4Mjg1Nw==;{'totalCount': 2};history last after update;2014-12-16T07:49:53Z;2014-12-16T08:09:06Z
3418;MDU6SXNzdWU1MjE0ODEyNg==;{'totalCount': 5};Explicitly document that customizing ZSH settings should come after loading oh-my-zsh;2014-12-16T18:19:21Z;2015-06-23T18:30:35Z
3420;MDU6SXNzdWU1MjI2Mjg5MA==;{'totalCount': 3};History no longer working between sessions;2014-12-17T16:48:25Z;2014-12-17T17:15:20Z
3421;MDU6SXNzdWU1MjM1NjA3MQ==;{'totalCount': 4};OSX: move files to the proper Trash;2014-12-18T12:00:12Z;2015-06-15T04:46:42Z
3425;MDU6SXNzdWU1MjQyODM2NQ==;{'totalCount': 15};Error message when logging in from a tty;2014-12-18T23:08:48Z;2015-09-19T15:53:14Z
3435;MDU6SXNzdWU1MjgwNDAzOA==;{'totalCount': 19};vi-mode plugin must be loaded first or it wipes out custom keybindings in other plugins;2014-12-24T08:23:03Z;
3436;MDU6SXNzdWU1MjgyOTE5OA==;{'totalCount': 6};glyphs not loading from themes, seeing question marks in console;2014-12-24T17:25:09Z;2014-12-27T03:45:27Z
3437;MDU6SXNzdWU1Mjg1OTkzOQ==;{'totalCount': 1};how to config the timeout time?;2014-12-25T11:26:12Z;2015-06-05T15:02:19Z
3438;MDU6SXNzdWU1Mjg3MjA3Nw==;{'totalCount': 8};OSX docker plugin not autocomplete ;2014-12-25T20:47:28Z;2016-09-20T18:38:11Z
3439;MDU6SXNzdWU1Mjg3NjM2MA==;{'totalCount': 3};Color themes;2014-12-26T01:26:38Z;2015-06-05T15:02:19Z
3440;MDU6SXNzdWU1Mjg3ODc5MA==;{'totalCount': 9};New commands don't completing;2014-12-26T03:02:52Z;2016-10-25T03:30:49Z
3441;MDU6SXNzdWU1Mjg5NDU1OQ==;{'totalCount': 1};stderr redirection in web-search plugin;2014-12-26T10:42:43Z;2015-02-10T19:22:25Z
3446;MDU6SXNzdWU1MzAyMzAwMg==;{'totalCount': 6};Update Error!!!;2014-12-29T06:41:49Z;2015-06-05T15:02:19Z
3447;MDU6SXNzdWU1MzAyNjA1Mw==;{'totalCount': 1};oh-my-zsh uninstall.sh issues - switch back to bash is unsatisfactory;2014-12-29T08:15:53Z;2019-05-31T12:38:08Z
3448;MDU6SXNzdWU1MzAyNjI5Ng==;{'totalCount': 0};deletion question - resolved;2014-12-29T08:22:34Z;2015-01-01T23:29:58Z
3450;MDU6SXNzdWU1MzA2MTM4MQ==;{'totalCount': 0};theme gnzh add mercurial prompt;2014-12-29T18:47:52Z;2019-04-04T21:34:37Z
3455;MDU6SXNzdWU1MzE0MTQzOQ==;{'totalCount': 19};compdef: unknown command or service: git;2014-12-30T19:46:31Z;2015-02-09T17:29:47Z
3457;MDU6SXNzdWU1MzE1MTIyMw==;{'totalCount': 2};Old command not working;2014-12-30T22:06:44Z;2015-02-17T18:57:43Z
3459;MDU6SXNzdWU1MzE1Nzk3Ng==;{'totalCount': 4};Users are instructed to run a script downloaded via HTTP;2014-12-31T00:05:08Z;2015-02-19T20:05:11Z
3466;MDU6SXNzdWU1MzMyODc1Mg==;{'totalCount': 8};How about setting HISTTIMEFORMAT by default ;2015-01-04T07:37:52Z;2015-01-04T08:15:34Z
3468;MDU6SXNzdWU1MzM1NzkyOA==;{'totalCount': 3};Syntax highlighting in less;2015-01-05T02:09:08Z;2015-01-05T05:20:29Z
3469;MDU6SXNzdWU1MzM2NDY4Mw==;{'totalCount': 2};[Bower] install certain version not working;2015-01-05T05:05:38Z;2015-01-06T01:24:15Z
3470;MDU6SXNzdWU1MzQyMDA3MQ==;{'totalCount': 8};grep options under OpenBSD;2015-01-05T17:22:24Z;2015-02-22T18:17:16Z
3477;MDU6SXNzdWU1Mzc1NDY3Nw==;{'totalCount': 1};Port to rcm?;2015-01-08T14:16:48Z;2015-01-08T18:03:36Z
3482;MDU6SXNzdWU1Mzk1OTcyOA==;{'totalCount': 0};Fedora support for command-not-found plugin;2015-01-10T14:30:41Z;2015-02-10T19:21:36Z
3484;MDU6SXNzdWU1Mzk4NTAyMg==;{'totalCount': 3};didn't find any theme for full path + display git changes;2015-01-11T07:46:23Z;2015-02-24T08:59:24Z
3485;MDU6SXNzdWU1Mzk5MTE3Mw==;{'totalCount': 7};Add new plugin for ansi weather;2015-01-11T13:02:09Z;2018-06-18T18:12:28Z
3487;MDU6SXNzdWU1Mzk5OTk2Nw==;{'totalCount': 1};Theme disabled after installing powerline;2015-01-11T18:31:53Z;2015-06-05T15:02:19Z
3488;MDU6SXNzdWU1NDAyMTgwNw==;{'totalCount': 3};Error with Github plugin;2015-01-12T05:28:53Z;2015-02-22T17:14:14Z
3491;MDU6SXNzdWU1NDM0NjE2Mg==;{'totalCount': 1};Cd command report ;2015-01-14T16:53:41Z;2015-02-10T19:17:18Z
3492;MDU6SXNzdWU1NDM1NzAxNQ==;{'totalCount': 3};Not autocompleting named directories;2015-01-14T18:22:00Z;2015-06-05T15:02:19Z
3495;MDU6SXNzdWU1NDQ0ODU0Nw==;{'totalCount': 4};Home and End keys aren't working;2015-01-15T13:24:12Z;2015-11-07T13:56:44Z
3505;MDU6SXNzdWU1NDg3MTc1MA==;{'totalCount': 12};Tab autocompletion of accented characters not working;2015-01-20T11:24:14Z;2015-02-18T15:07:28Z
3507;MDU6SXNzdWU1NDkzNjYxOA==;{'totalCount': 5};zsh: command not found: brew;2015-01-20T20:42:02Z;2015-02-18T09:44:17Z
3510;MDU6SXNzdWU1NDk4MDU2NA==;{'totalCount': 1};zsh prompt not working after recent update when change to root while it's all going well on non-root;2015-01-21T05:52:01Z;2015-02-16T06:39:12Z
3512;MDU6SXNzdWU1NTA4ODQ3OQ==;{'totalCount': 1};zsh: locking failed for [user]/.zsh_history: permission denied: reading anyway;2015-01-21T22:41:24Z;2015-02-22T00:32:24Z
3516;MDU6SXNzdWU1NTMyNDM2MQ==;{'totalCount': 9};"Authentication failure at ""Changing shell for x"" ";2015-01-23T19:50:02Z;2015-06-15T04:46:42Z
3520;MDU6SXNzdWU1NTQ3NzQwNg==;{'totalCount': 3};lxc-docker support (docker.io error);2015-01-26T12:34:44Z;2015-09-02T08:32:39Z
3521;MDU6SXNzdWU1NTQ5Mzc5OA==;{'totalCount': 3};Tab autocomplete does not support git subtree;2015-01-26T15:17:02Z;2018-06-18T19:25:35Z
3524;MDU6SXNzdWU1NTcwNzQ1MA==;{'totalCount': 5};Output from chpwd hook contaminates script output;2015-01-28T02:54:10Z;2015-02-10T15:27:03Z
3527;MDU6SXNzdWU1NTc1Nzk5MA==;{'totalCount': 2};Tailoring 'less';2015-01-28T13:49:09Z;2015-04-05T14:18:27Z
3528;MDU6SXNzdWU1NTgzNzE3OA==;{'totalCount': 1};never mind...;2015-01-29T00:18:27Z;2015-01-29T00:18:43Z
3529;MDU6SXNzdWU1NTg1Mzc4MQ==;{'totalCount': 1};backgroud color;2015-01-29T04:09:25Z;2015-06-05T15:02:19Z
3531;MDU6SXNzdWU1NjAwOTI1NQ==;{'totalCount': 17};"Compass watch compile error ""Invalid US-ASCII character ""\xE2""""";2015-01-30T08:59:29Z;2015-10-18T14:11:37Z
3532;MDU6SXNzdWU1NjAxMDYxMg==;{'totalCount': 9};git plugin uses '--ignore-submodules=dirty';2015-01-30T09:16:13Z;2018-06-12T20:16:37Z
3535;MDU6SXNzdWU1NjIxMzE3Nw==;{'totalCount': 5};add `git add --all` alias;2015-02-02T09:27:48Z;2015-02-22T18:13:34Z
3537;MDU6SXNzdWU1NjI2MTExMg==;{'totalCount': 12};vi-mode does not update prompt correctly when window resized;2015-02-02T16:50:10Z;2015-02-10T19:20:42Z
3539;MDU6SXNzdWU1NjI5MDI5Ng==;{'totalCount': 1};tmux plugin: can't start new session;2015-02-02T20:43:01Z;2015-06-05T15:02:19Z
3546;MDU6SXNzdWU1NjUxMzY5NA==;{'totalCount': 5};Add git-open;2015-02-04T11:15:05Z;2015-02-05T08:42:09Z
3548;MDU6SXNzdWU1NjUyNTczOA==;{'totalCount': 2};segfault with ubuntu 12.04;2015-02-04T13:26:05Z;2017-03-25T13:01:11Z
3550;MDU6SXNzdWU1NjU2Mzc5Mg==;{'totalCount': 22};cd:cd:13 in Cygwin root;2015-02-04T18:01:21Z;2015-02-22T01:04:25Z
3552;MDU6SXNzdWU1NjY3MDM4NQ==;{'totalCount': 1};Update crashed oh-my-zsh;2015-02-05T13:34:03Z;2015-02-05T15:02:07Z
3553;MDU6SXNzdWU1NjY3MTUwNw==;{'totalCount': 1};some plugins doesnt work in ubuntu14.04?;2015-02-05T13:44:53Z;2015-02-07T11:18:02Z
3557;MDU6SXNzdWU1NjkxMDQwOQ==;{'totalCount': 6};[feature] add 'docker-composer' plugin bundler;2015-02-07T12:54:55Z;2015-10-18T14:12:09Z
3562;MDU6SXNzdWU1NzA2NTEyNQ==;{'totalCount': 5};ssh-agent replacing existing ssh identity with empty one when zsh is started.;2015-02-09T17:50:17Z;2019-02-12T19:52:07Z
3565;MDU6SXNzdWU1NzExNTg0NQ==;{'totalCount': 2};Main $ZSH variable for OMZSH causes conflicts;2015-02-10T01:08:38Z;2015-02-22T17:13:44Z
3570;MDU6SXNzdWU1NzM1MjQ5Mw==;{'totalCount': 7};New Terminal tabs no longer default to the current working directory;2015-02-11T17:59:33Z;2015-02-13T15:17:17Z
3576;MDU6SXNzdWU1NzU0MTk5Nw==;{'totalCount': 4};Update blew up;2015-02-13T00:28:53Z;2015-02-13T20:27:04Z
3579;MDU6SXNzdWU1NzY3NjA5Mg==;{'totalCount': 8};AUTO_TITLE functionality breaks in tmux;2015-02-14T01:45:39Z;2019-04-06T20:27:48Z
3581;MDU6SXNzdWU1NzcxMTI1OA==;{'totalCount': 5};termsupport Terminal.app stuff fails for dirs with special chars and remote hosts;2015-02-14T23:49:14Z;2015-02-16T21:55:35Z
3583;MDU6SXNzdWU1NzcxMzQ1MQ==;{'totalCount': 2};Terminal.app cwd update is garbled for multibyte characters;2015-02-15T01:23:15Z;2015-09-19T15:48:04Z
3585;MDU6SXNzdWU1NzcxNDY5Ng==;{'totalCount': 3};theme plugin side effects (cwd & variables) and inconsistency;2015-02-15T02:21:54Z;2015-02-21T16:57:15Z
3586;MDU6SXNzdWU1NzcxNDc4NA==;{'totalCount': 1};lib/theme-and-appearance.zsh sets non-appearance options;2015-02-15T02:25:50Z;
3588;MDU6SXNzdWU1NzcxOTc2MA==;{'totalCount': 6};Installer fails on cygwin with git and chsh errors;2015-02-15T06:23:30Z;2015-09-26T16:35:39Z
3595;MDU6SXNzdWU1Nzc4NjU3Mw==;{'totalCount': 5};Everything broken after auto-update;2015-02-16T10:19:56Z;2015-02-16T10:42:47Z
3600;MDU6SXNzdWU1Nzg4NzEzNw==;{'totalCount': 2};The install needs to be as secure as possible!;2015-02-17T06:07:46Z;2015-02-22T00:30:05Z
3602;MDU6SXNzdWU1Nzk0MzE0Nw==;{'totalCount': 5};compinit:473: bad output format specification;2015-02-17T16:07:42Z;2015-02-18T17:48:35Z
3604;MDU6SXNzdWU1ODE3ODc5OQ==;{'totalCount': 4};Chuck norris plugin not working on os x;2015-02-19T08:13:51Z;2018-06-12T20:23:42Z
3605;MDU6SXNzdWU1ODE4NjgzOQ==;{'totalCount': 5};vi-mode broken since last auto-update?;2015-02-19T09:52:23Z;2015-02-22T17:17:17Z
3612;MDU6SXNzdWU1ODMxNTE3Ng==;{'totalCount': 0};"Installer leaks ""~/.zshrc-e"" file, maybe from bad ""-i"" option";2015-02-20T06:28:34Z;2015-08-30T16:13:04Z
3614;MDU6SXNzdWU1ODM2MTk5NQ==;{'totalCount': 4};Consider spring cleanup of non-essentials from lib/;2015-02-20T14:45:34Z;2015-06-15T05:09:13Z
3619;MDU6SXNzdWU1ODQ4Mjc2OA==;{'totalCount': 5};[TEST] placeholder for screenshot images;2015-02-22T00:32:20Z;2015-02-22T00:32:39Z
3620;MDU6SXNzdWU1ODQ5NjQ1MA==;{'totalCount': 4};TRAPWINCH:zle:2: widgets can only be called when ZLE is active;2015-02-22T09:18:46Z;2015-02-22T15:37:44Z
3621;MDU6SXNzdWU1ODUxMjAwNw==;{'totalCount': 1};Cloud symbol not showing properly;2015-02-22T18:14:44Z;2015-06-05T15:02:19Z
3626;MDU6SXNzdWU1ODUyMjA5Nw==;{'totalCount': 1};Up-Arrow when typing only works for the first command;2015-02-22T21:56:14Z;2015-02-22T22:04:17Z
3628;MDU6SXNzdWU1ODUzMDQ2MA==;{'totalCount': 2};How to make the git branch completion work?;2015-02-23T00:19:34Z;2015-02-25T23:02:29Z
3629;MDU6SXNzdWU1ODU3NDgyOQ==;{'totalCount': 3};cask.plugin.zsh sourcing wrong path;2015-02-23T11:38:04Z;2016-08-25T16:37:23Z
3631;MDU6SXNzdWU1ODY1Mzc0MA==;{'totalCount': 2};Messed up prompt after last update;2015-02-23T21:43:40Z;2015-02-27T20:27:25Z
3633;MDU6SXNzdWU1ODcwMjk2Mg==;{'totalCount': 3};"The nuptial problem about ""silversearcher - ag"". ";2015-02-24T07:27:28Z;2015-03-26T06:58:12Z
3634;MDU6SXNzdWU1ODcxNjk0Nw==;{'totalCount': 6};Can have a special man page for alias of git plugins?;2015-02-24T10:06:06Z;2015-06-05T15:02:19Z
3640;MDU6SXNzdWU1OTA1MjI0OQ==;{'totalCount': 6};npmd alias is messing with the fantastic npmd module;2015-02-26T10:32:50Z;2015-03-30T14:37:40Z
3645;MDU6SXNzdWU1OTE4NzcwMQ==;{'totalCount': 2};Emacs Terminal Emulator completion / menu issues;2015-02-27T04:23:49Z;2015-10-18T14:16:31Z
3649;MDU6SXNzdWU1OTMzMzY5NA==;{'totalCount': 3};docker completion plugin error: permission denied;2015-02-28T09:02:24Z;2015-03-24T06:14:22Z
