number;id;comments;title;createdAt;closedAt
7150;MDU6SXNzdWUzNjI5NDc5MDI=;{'totalCount': 1};long running wizard failed to load module;2018-09-23T14:41:13Z;2018-09-23T19:31:01Z
7155;MDU6SXNzdWUzNjMyODY4MDU=;{'totalCount': 1};Buggy characters at the beginning of each line;2018-09-24T19:25:35Z;2018-09-25T16:51:34Z
7156;MDU6SXNzdWUzNjMzNDk4MzU=;{'totalCount': 2};oh-my-zsh.sh:5: parse error near 'fi';2018-09-24T22:55:03Z;2018-09-25T15:22:22Z
7158;MDU6SXNzdWUzNjM0OTczNDA=;{'totalCount': 2};Spawning zsh processes in a loop after upgrade;2018-09-25T09:54:43Z;2018-09-28T13:36:28Z
7160;MDU6SXNzdWUzNjM2MzQ5MTQ=;{'totalCount': 14};Path display error;2018-09-25T15:24:28Z;2018-10-07T21:08:44Z
7163;MDU6SXNzdWUzNjM5NTM3MTI=;{'totalCount': 1};docker completion stopped by flags;2018-09-26T10:14:46Z;2018-09-26T15:26:13Z
7164;MDU6SXNzdWUzNjQxMjA5MzQ=;{'totalCount': 1};`source` points to the wrong directory in MSYS2 when Cygwin is installed;2018-09-26T16:48:48Z;2019-04-09T09:49:38Z
7168;MDU6SXNzdWUzNjQ3NjgxMTc=;{'totalCount': 1};clean theme display error;2018-09-28T07:12:47Z;2019-04-09T09:52:57Z
7170;MDU6SXNzdWUzNjUwNjc2MTg=;{'totalCount': 1};adding current branch name on all the timestamp lines?;2018-09-28T23:02:22Z;2018-10-01T19:41:59Z
7171;MDU6SXNzdWUzNjUxMTAxMTQ=;{'totalCount': 6};complete:13: command not found: compdef #3356;2018-09-29T08:12:52Z;2018-10-09T18:59:31Z
7175;MDU6SXNzdWUzNjUyNjM2MzQ=;{'totalCount': 109};[Good first PR] Add READMEs to undocumented plugins;2018-09-30T21:31:55Z;2019-12-27T01:53:26Z
7179;MDU6SXNzdWUzNjU0MDU2OTI=;{'totalCount': 1};command_not_found in Opensuse Tumbleweed;2018-10-01T10:48:03Z;2018-10-01T10:51:27Z
7182;MDU6SXNzdWUzNjU2NTA1OTM=;{'totalCount': 7};permission denied: /root/.oh-my-zsh/oh-my-zsh.sh;2018-10-01T21:28:03Z;2018-10-02T10:47:58Z
7193;MDU6SXNzdWUzNjYxMTU1NTM=;{'totalCount': 2};Revisiting old issues and PRs and suggestion adding probot/stale;2018-10-02T23:16:21Z;2019-03-31T20:38:49Z
7195;MDU6SXNzdWUzNjYyMDcyMjQ=;{'totalCount': 2};Jump: reusing a mark leads to unintended behavior;2018-10-03T07:25:54Z;2018-10-03T14:21:51Z
7234;MDU6SXNzdWUzNjcxMjMxNjA=;{'totalCount': 3};Oh-my-zsh & tmux outputting unexpected messages ;2018-10-05T09:08:00Z;
7240;MDU6SXNzdWUzNjc0NTI3MjY=;{'totalCount': 3};"plugin colorize ""false not detecting pygments""";2018-10-06T12:27:38Z;2018-10-08T13:14:24Z
7246;MDU6SXNzdWUzNjc1NTU0Njk=;{'totalCount': 6};zsh fedora 29 and oh-my-zsh broke my system;2018-10-07T13:38:55Z;2018-10-08T07:59:36Z
7255;MDU6SXNzdWUzNjc5NzExMjU=;{'totalCount': 2};history-substring-search matches only from beginning of line;2018-10-08T22:13:14Z;
7257;MDU6SXNzdWUzNjgwMjUyMDc=;{'totalCount': 1};when type 'd' command, maybe It's better to show number after path;2018-10-09T03:17:07Z;2018-10-09T07:02:45Z
7259;MDU6SXNzdWUzNjgwNzYxMTc=;{'totalCount': 5};self-update on macOS aborts on case-different filename;2018-10-09T07:31:41Z;
7260;MDU6SXNzdWUzNjgxMDUzODc=;{'totalCount': 1};r;2018-10-09T08:54:07Z;2018-10-09T08:54:25Z
7261;MDU6SXNzdWUzNjgyNTU4Mjk=;{'totalCount': 3};Plugin: kube-ps1: Do not auto-add to PROMPT;2018-10-09T15:00:22Z;2019-04-09T20:41:37Z
7262;MDU6SXNzdWUzNjgyNTU4NTg=;{'totalCount': 8};zsh 5.6.2 tmux 2.7 gentoo theme 'cmdand cursh' prompt;2018-10-09T15:00:25Z;2019-03-25T16:10:43Z
7263;MDU6SXNzdWUzNjg0ODE3OTM=;{'totalCount': 1};UP Arrow Key binding;2018-10-10T03:40:02Z;2018-10-18T13:28:14Z
7268;MDU6SXNzdWUzNjkxMDI5MjA=;{'totalCount': 3};Problem with backslash on DOMAIN\User;2018-10-11T12:42:57Z;2018-10-17T18:55:05Z
7271;MDU6SXNzdWUzNjk1NzMyMDI=;{'totalCount': 2};Composer autocomplete doesn't work;2018-10-12T14:21:42Z;2019-04-09T19:23:26Z
7278;MDU6SXNzdWUzNjk3MjIzMjk=;{'totalCount': 1};zsh: permission denied: live-server ( or any global package with zsh);2018-10-12T21:51:27Z;2018-10-17T16:34:46Z
7280;MDU6SXNzdWUzNjk3NjE1NjY=;{'totalCount': 1};How to use user-defined compdef?;2018-10-13T03:15:51Z;2018-10-13T03:19:14Z
7284;MDU6SXNzdWUzNjk3ODA0NTM=;{'totalCount': 8};Tab autocomplete on ssh uses Hostname instead of Host;2018-10-13T08:22:33Z;2019-08-19T16:26:29Z
7285;MDU6SXNzdWUzNjk3ODM1NTQ=;{'totalCount': 3};agnoster: Unable to correctly identify non-repository directories;2018-10-13T09:07:34Z;2019-04-09T10:28:12Z
7290;MDU6SXNzdWUzNjk4NzIyMTA=;{'totalCount': 4};zsh: command not found: mysqladmin5;2018-10-14T06:21:42Z;2018-10-21T19:54:50Z
7297;MDU6SXNzdWUzNzA0ODg0MDE=;{'totalCount': 0};iwhois: server whois.geek.nz is down;2018-10-16T08:09:00Z;2019-04-09T10:05:52Z
7298;MDU6SXNzdWUzNzA1MDEwODI=;{'totalCount': 7};django plugin - does not work with python2/python3;2018-10-16T08:43:05Z;2019-12-13T14:04:12Z
7301;MDU6SXNzdWUzNzA5NTAyMDQ=;{'totalCount': 1};Enable command-not-found by default;2018-10-17T08:13:59Z;2018-10-17T16:59:43Z
7302;MDU6SXNzdWUzNzA5NzQ5NDY=;{'totalCount': 5};Some themes not working;2018-10-17T09:15:35Z;2019-04-09T10:24:46Z
7308;MDU6SXNzdWUzNzE0NTcxODY=;{'totalCount': 5};Completion for some plugins not working;2018-10-18T10:11:48Z;2019-04-09T13:38:12Z
7315;MDU6SXNzdWUzNzIxMzU1OTU=;{'totalCount': 3};Wild Card not expanding. ;2018-10-19T22:26:29Z;2018-10-21T20:27:42Z
7320;MDU6SXNzdWUzNzIzNTgwMDU=;{'totalCount': 1};[Archlinux plugin] name masking;2018-10-21T21:18:05Z;2018-10-24T15:46:59Z
7328;MDU6SXNzdWUzNzI5NTgxMDE=;{'totalCount': 2};Load plugin completions without aliases;2018-10-23T11:48:23Z;
7330;MDU6SXNzdWUzNzMwNTMwNDY=;{'totalCount': 8};Home and End key work not correctly when use plugin vi-mode ...;2018-10-23T15:10:47Z;2019-03-18T00:29:50Z
7331;MDU6SXNzdWUzNzM1MTYzNzM=;{'totalCount': 1}; [per-directory-history] Multiple shells in the same folder do not share history;2018-10-24T14:36:07Z;2019-04-09T10:23:00Z
7332;MDU6SXNzdWUzNzM2NzExNTU=;{'totalCount': 29};Allow creation of zcompdump in a custom directory;2018-10-24T20:49:15Z;
7336;MDU6SXNzdWUzNzM3OTAxNjU=;{'totalCount': 1};(Request) Would be nice to make compaudit/compinit during initialization entirely optional;2018-10-25T06:19:05Z;2019-04-09T10:37:31Z
7340;MDU6SXNzdWUzNzQxMTY1ODk=;{'totalCount': 2};Unable to access .oh-my-zsh through symbolic link on Windows WSL;2018-10-25T20:21:47Z;2018-10-25T23:59:30Z
7347;MDU6SXNzdWUzNzQzOTM2MjQ=;{'totalCount': 2};history-substring-search plugin doesn't works;2018-10-26T13:51:25Z;2019-04-09T10:42:34Z
7348;MDU6SXNzdWUzNzQ1Nzg2MjI=;{'totalCount': 4};QUESTION: How to disable tab completion on foreign file systems?;2018-10-26T23:26:14Z;
7349;MDU6SXNzdWUzNzQ1ODAyMTk=;{'totalCount': 0};Wrong handling of time since last commit in Avit theme;2018-10-26T23:36:49Z;2018-10-27T15:09:56Z
7351;MDU6SXNzdWUzNzQ1ODc2NTU=;{'totalCount': 1};Manuall Install without Git on command line.;2018-10-27T00:34:47Z;2018-10-27T15:06:52Z
7352;MDU6SXNzdWUzNzQ2NjE4NzA=;{'totalCount': 3};ssh-agent plugin: identities not loaded;2018-10-27T16:16:38Z;2019-01-22T10:20:18Z
7371;MDU6SXNzdWUzNzU1MDI2NDU=;{'totalCount': 3};Deprecate transfer plugin;2018-10-30T13:57:15Z;2018-10-30T18:44:49Z
7380;MDU6SXNzdWUzNzYxMzM4MzQ=;{'totalCount': 3};SSH Autocomplete on WSL is very slow;2018-10-31T19:50:53Z;2019-04-09T11:26:14Z
7381;MDU6SXNzdWUzNzYyMDcwODI=;{'totalCount': 6};Self-update fails if start folder is repository;2018-11-01T00:17:11Z;2018-11-07T00:07:31Z
7383;MDU6SXNzdWUzNzYzMjIzMDg=;{'totalCount': 7};The prompt is missing in Midnight Commander;2018-11-01T09:47:41Z;2018-11-04T11:15:53Z
7384;MDU6SXNzdWUzNzY0OTMyNTk=;{'totalCount': 1};git plugin latency;2018-11-01T17:33:48Z;2018-11-02T20:50:57Z
7387;MDU6SXNzdWUzNzcxNDk3Mzc=;{'totalCount': 1};source error;2018-11-04T12:52:12Z;2018-11-04T13:03:14Z
7389;MDU6SXNzdWUzNzcyMjg3MTY=;{'totalCount': 1};prepend conda to PATH on macOS High Sierra version 10.13.6 ;2018-11-05T02:31:08Z;2019-04-09T10:34:00Z
7390;MDU6SXNzdWUzNzc1Mzk5NzU=;{'totalCount': 0};$shell;2018-11-05T19:06:47Z;2018-11-05T22:06:25Z
7391;MDU6SXNzdWUzNzc1ODgzMDU=;{'totalCount': 1};plugin dev question - check for local files ;2018-11-05T21:23:23Z;2019-04-09T10:41:39Z
7392;MDU6SXNzdWUzNzgxMjU4MzI=;{'totalCount': 1};export REACT_EDITOR=atom;2018-11-07T03:16:40Z;2018-11-07T11:15:58Z
7393;MDU6SXNzdWUzNzgxNTQ3MzE=;{'totalCount': 1};zle reset-prompt breaks tab completion for multi-line prompts;2018-11-07T06:07:57Z;2020-02-19T17:02:44Z
7395;MDU6SXNzdWUzNzg0Mjg3ODQ=;{'totalCount': 5};after update to macOs Mojave zsh broken;2018-11-07T19:10:48Z;2019-03-24T10:17:39Z
7397;MDU6SXNzdWUzNzg3MDA1NDI=;{'totalCount': 3};Ignore blocked DNS hostnames in /etc/hosts in autocompletion ;2018-11-08T11:59:27Z;2019-04-09T10:49:39Z
7399;MDU6SXNzdWUzNzkzNTc1MDA=;{'totalCount': 4};Files of .oh-my-zsh, .zshrc are not created;2018-11-09T23:30:04Z;2018-11-12T19:02:50Z
7400;MDU6SXNzdWUzNzk0ODQ1Nzg=;{'totalCount': 0};iTerm;2018-11-11T03:04:49Z;2018-11-12T19:01:22Z
7401;MDU6SXNzdWUzNzk1MDc1MjA=;{'totalCount': 1};Calling a function when custom alias called;2018-11-11T09:59:37Z;2018-11-12T18:57:36Z
7403;MDU6SXNzdWUzODAxNzU3MDY=;{'totalCount': 0};"Add golang completion to ""go help environment""";2018-11-13T11:15:20Z;2018-11-16T21:53:30Z
7405;MDU6SXNzdWUzODAxODMzNTY=;{'totalCount': 1};Fabric completion broken after latest update;2018-11-13T11:35:06Z;2018-11-16T18:57:53Z
7406;MDU6SXNzdWUzODAyMjQyMzc=;{'totalCount': 1};ctrl-v visual mode in nvim broken after recent update;2018-11-13T13:25:10Z;2018-11-13T15:41:13Z
7407;MDU6SXNzdWUzODAyODg2ODE=;{'totalCount': 10};tmux plugin fails to detect 256-colour support on FreeBSD;2018-11-13T15:41:14Z;2018-11-26T18:58:21Z
7408;MDU6SXNzdWUzODA1NjkwNzU=;{'totalCount': 6};when install oh-my-zsh oh aliyun ecs  debian other user can not access file at root user home ;2018-11-14T07:28:29Z;2018-11-16T21:50:28Z
7409;MDU6SXNzdWUzODA1OTA2NTE=;{'totalCount': 1};The `.` command only finds files from PATH;2018-11-14T08:42:16Z;2018-11-14T16:41:47Z
7411;MDU6SXNzdWUzODE1MzkyNDc=;{'totalCount': 2};docker-compose plugin autocompleting wrong for start|stop|restart|exec;2018-11-16T10:27:51Z;2019-02-15T08:51:03Z
7412;MDU6SXNzdWUzODE2MzcwMDk=;{'totalCount': 1};Unable to type non-ASCII chars on Mac <ffffffff>;2018-11-16T15:07:30Z;2018-11-16T15:19:28Z
7413;MDU6SXNzdWUzODE2NjY2OTA=;{'totalCount': 2};Error installing oh my zsh with .gitconfig on current directory;2018-11-16T16:18:21Z;2019-04-09T18:17:33Z
7414;MDU6SXNzdWUzODE3MjU2OTQ=;{'totalCount': 2};Rbenv slow;2018-11-16T19:13:26Z;2019-05-08T07:53:16Z
7415;MDU6SXNzdWUzODE4ODYxNTU=;{'totalCount': 1};How to get 'git help log' colored as 'man ls'?;2018-11-17T18:05:43Z;2018-11-18T17:59:07Z
7416;MDU6SXNzdWUzODE5MjEzMDU=;{'totalCount': 2};Where do I find the zsh theme folder?;2018-11-18T02:25:33Z;2018-11-19T21:39:21Z
7419;MDU6SXNzdWUzODIyMDkzOTc=;{'totalCount': 1};Git no indication when new untracked files are being added;2018-11-19T13:15:07Z;2019-04-09T10:53:32Z
7420;MDU6SXNzdWUzODI0NDUyMzA=;{'totalCount': 5};Garbled command line in IntelliJ + Tmux;2018-11-20T00:11:52Z;2018-11-22T09:51:30Z
7422;MDU6SXNzdWUzODI0NjQwNzU=;{'totalCount': 7};sometime, oh-my-zsh Taking too much time while login;2018-11-20T01:44:49Z;2019-02-12T22:16:39Z
7423;MDU6SXNzdWUzODI1ODA5MTI=;{'totalCount': 1};buy 'oh-my-zsh' T-shirt on official store ,delivering over a month and didn't receive yet;2018-11-20T09:51:10Z;2018-11-20T18:00:47Z
7424;MDU6SXNzdWUzODI2MTA2NTI=;{'totalCount': 1};visual studio code not able to run zsh as integrated shell after enabling aws plugin;2018-11-20T11:03:09Z;2018-11-21T09:01:50Z
7426;MDU6SXNzdWUzODI5NDM1NDc=;{'totalCount': 5};First characters of prompt are repeated after tab autocompletion (in a docker container);2018-11-21T03:47:21Z;2019-04-09T18:50:53Z
7428;MDU6SXNzdWUzODMyMDg4NDY=;{'totalCount': 6};Piping to non-existant command fails silently;2018-11-21T16:51:09Z;2018-12-21T21:34:37Z
7430;MDU6SXNzdWUzODM3NDc4MTA=;{'totalCount': 2};Add stackoverflow;2018-11-23T09:14:39Z;2018-11-30T18:21:37Z
7431;MDU6SXNzdWUzODM3NTQ0MTE=;{'totalCount': 5};Using vi-mode plugin conflicts with sudo plugin's EscEsc sequence;2018-11-23T09:36:45Z;2019-08-19T10:14:23Z
7432;MDU6SXNzdWUzODM5MDQ1Mjk=;{'totalCount': 2};History Wrapper in omz_history breaks with zsh nounset and no options are passed;2018-11-23T18:27:22Z;2019-04-09T10:58:46Z
7434;MDU6SXNzdWUzODM5NDk1MzE=;{'totalCount': 1};PhPStorm terminal UI Bug;2018-11-24T01:37:11Z;2019-04-09T11:18:37Z
7436;MDU6SXNzdWUzODM5OTMyMDY=;{'totalCount': 3};Linuxbrew ZSH;2018-11-24T14:18:21Z;2019-01-13T20:40:57Z
7439;MDU6SXNzdWUzODQxMDU1Njc=;{'totalCount': 1};zsh-dircolors-solarized not being loaded;2018-11-25T18:37:34Z;2019-04-09T11:03:54Z
7444;MDU6SXNzdWUzODQ4MjUwNDY=;{'totalCount': 1};Dotenv plugin breaks my prompt;2018-11-27T14:37:58Z;2019-04-09T10:59:15Z
7447;MDU6SXNzdWUzODUzNzAzMjk=;{'totalCount': 1};Themes not loading;2018-11-28T17:09:24Z;2019-03-25T22:06:01Z
7449;MDU6SXNzdWUzODU2MTk0NjI=;{'totalCount': 2};update error in KDE NEON ;2018-11-29T08:23:49Z;2019-04-09T18:16:08Z
7450;MDU6SXNzdWUzODU4NTUyNTQ=;{'totalCount': 1};when press ctrl+c or run any command which is not in mac, promt breaks;2018-11-29T17:54:43Z;2019-04-09T11:01:08Z
7453;MDU6SXNzdWUzODY0MDM5NzA=;{'totalCount': 6};alias folder navigation;2018-12-01T01:10:48Z;2019-02-06T11:26:33Z
7458;MDU6SXNzdWUzODcxNzA5MTU=;{'totalCount': 2};Pip plugin doesn't use current python version;2018-12-04T08:28:38Z;
7459;MDU6SXNzdWUzODcyNzc0OTg=;{'totalCount': 16};Git branch completion doesn't work;2018-12-04T13:07:46Z;2019-12-09T23:24:54Z
7461;MDU6SXNzdWUzODc4ODQxMjI=;{'totalCount': 1};shrink-path chops folders with spaces;2018-12-05T18:20:08Z;
7462;MDU6SXNzdWUzODgxMDcyMTI=;{'totalCount': 2};parse error near `\n';2018-12-06T08:34:57Z;2019-01-30T15:18:57Z
7463;MDU6SXNzdWUzODg0MjgwODc=;{'totalCount': 0};Buggy vi-mode on Ubuntu;2018-12-06T22:37:57Z;2018-12-06T22:44:11Z
7464;MDU6SXNzdWUzODg4ODAzODY=;{'totalCount': 2};yarn workspaces support;2018-12-08T03:32:28Z;2019-04-09T11:36:50Z
7465;MDU6SXNzdWUzODkxMzc5ODg=;{'totalCount': 7};echo/cat/all out doesn't work correctly with one symbol;2018-12-10T04:47:06Z;2019-02-12T22:12:47Z
7466;MDU6SXNzdWUzODk1NzYwMjU=;{'totalCount': 2};how can i change git branch listing?;2018-12-11T02:59:13Z;2019-01-16T19:02:30Z
7467;MDU6SXNzdWUzOTA0OTg5MTA=;{'totalCount': 2};auto-suggest is always stop my type;2018-12-13T03:07:09Z;2019-04-09T12:07:20Z
7468;MDU6SXNzdWUzOTA2MjY1OTQ=;{'totalCount': 1};Unable to automate update of zsh and make it unattended;2018-12-13T11:02:37Z;2019-04-09T11:28:04Z
7471;MDU6SXNzdWUzOTE3MDYwMzA=;{'totalCount': 8};Newline on every command;2018-12-17T13:13:05Z;2019-01-20T17:00:41Z
7474;MDU6SXNzdWUzOTI0MDkzNjU=;{'totalCount': 2};Git plugin stash alias should use push instead of save;2018-12-19T01:57:18Z;2019-04-09T16:33:16Z
7476;MDU6SXNzdWUzOTM4NTAwNjc=;{'totalCount': 1};Some plugins not loaded correctly;2018-12-24T10:04:31Z;2018-12-24T12:31:33Z
7477;MDU6SXNzdWUzOTM5MjE2NTg=;{'totalCount': 2};[Suggestion] Cache the ssh passphrase upon first use;2018-12-24T19:04:01Z;
7478;MDU6SXNzdWUzOTQxMDg3NDI=;{'totalCount': 1};fzf-history-widget: fc:3: history events are in wrong order, aborted;2018-12-26T08:01:21Z;2018-12-26T20:37:36Z
7480;MDU6SXNzdWUzOTQzNTQxNTc=;{'totalCount': 0};docker-compose run service on unbuilt container;2018-12-27T10:14:54Z;2019-04-09T12:45:49Z
7482;MDU6SXNzdWUzOTQ3NDg2OTk=;{'totalCount': 1};theme color don't on macOS Mojave;2018-12-29T01:37:13Z;2018-12-29T14:41:41Z
7483;MDU6SXNzdWUzOTQ3NTM0MjI=;{'totalCount': 0};bira.zsh:virtualenv don't show before activated;2018-12-29T02:39:25Z;2019-04-09T13:50:15Z
7484;MDU6SXNzdWUzOTQ4MTA0MTk=;{'totalCount': 0};Ctrl Left/Right on different Terminals;2018-12-29T17:06:21Z;
7485;MDU6SXNzdWUzOTQ4MTEwMjc=;{'totalCount': 2};what is the name of this theme;2018-12-29T17:16:44Z;2018-12-31T19:10:27Z
7487;MDU6SXNzdWUzOTQ5Mzg4NTY=;{'totalCount': 3};oh-my-zsh inxi issue;2018-12-31T07:04:22Z;2019-02-04T16:22:31Z
7488;MDU6SXNzdWUzOTUwMDUzNzI=;{'totalCount': 1};Alias gcom=gco master;2018-12-31T16:46:04Z;2019-01-03T19:08:14Z
7489;MDU6SXNzdWUzOTUwODkyNTg=;{'totalCount': 2};Oh-my-zsh containers plug-ins (podman & buildah);2019-01-01T14:45:30Z;
7490;MDU6SXNzdWUzOTUxMTE1NDU=;{'totalCount': 1};When you insert the command appears white fill;2019-01-01T20:58:30Z;2019-04-09T18:15:10Z
7492;MDU6SXNzdWUzOTU0MzIzNjY=;{'totalCount': 3};Install fails on Ubuntu 18.04 and 18.10;2019-01-03T01:26:51Z;2019-01-15T18:01:34Z
7493;MDU6SXNzdWUzOTU0OTc3MTM=;{'totalCount': 1};How do i use default commands mac?;2019-01-03T09:00:59Z;2019-01-20T16:46:12Z
7495;MDU6SXNzdWUzOTYyMjA4NDU=;{'totalCount': 0};docker-machine plugin should tell you which docker-machine environment you're in;2019-01-06T02:16:04Z;
7497;MDU6SXNzdWUzOTYyNTU5MjA=;{'totalCount': 2};How to leave cursor at the position in forward-i-search mode;2019-01-06T12:56:31Z;2019-02-03T16:24:26Z
7500;MDU6SXNzdWUzOTY1MTgyMDY=;{'totalCount': 1};Random emoji for each line ;2019-01-07T14:55:45Z;2019-04-09T11:52:39Z
7502;MDU6SXNzdWUzOTY4ODQyNTI=;{'totalCount': 0};Hard to separate `ahead` or `behind` from `git_remote_status`;2019-01-08T12:24:29Z;
7505;MDU6SXNzdWUzOTgxMzU2MTc=;{'totalCount': 1};fore ground command `fg` not working well;2019-01-11T05:17:36Z;2019-01-11T06:46:55Z
7506;MDU6SXNzdWUzOTg2MTEzOTA=;{'totalCount': 1};#7174 requires same SSH key passphrase to be entered multiple times on automatic SSH key loading;2019-01-13T02:12:14Z;2019-01-14T15:42:15Z
7508;MDU6SXNzdWUzOTg2ODkyMDY=;{'totalCount': 1};"make ""d"" remember the pathes globally";2019-01-13T19:14:06Z;2019-01-14T16:03:31Z
7509;MDU6SXNzdWUzOTg3NDEyNjg=;{'totalCount': 8};ZSH keeps on asking for passphrase;2019-01-14T03:58:38Z;2019-01-17T09:53:48Z
7510;MDU6SXNzdWUzOTg3ODQ3ODc=;{'totalCount': 3};Theme astm Missing;2019-01-14T08:16:44Z;2019-01-16T18:54:46Z
7512;MDU6SXNzdWUzOTg5MjEzNzI=;{'totalCount': 1};font not display correct;2019-01-14T14:49:02Z;2019-01-16T10:10:53Z
7513;MDU6SXNzdWUzOTkwMzM4MjM=;{'totalCount': 2};function definition not found ;2019-01-14T19:15:32Z;2019-03-12T18:34:52Z
7516;MDU6SXNzdWUzOTkyMjE3NDI=;{'totalCount': 4};ssh-add always prompts for password;2019-01-15T07:40:15Z;2019-01-21T19:31:31Z
7519;MDU6SXNzdWUzOTkzMzY2ODA=;{'totalCount': 1};request support: rebar3 plugin;2019-01-15T13:06:11Z;2019-01-25T14:19:03Z
7522;MDU6SXNzdWU0MDAwNjI1ODY=;{'totalCount': 1};zsh-syntax-highlighting only loads after I source .zshrc manually;2019-01-17T00:44:58Z;2019-01-17T18:25:08Z
7523;MDU6SXNzdWU0MDAxMjQ1NTY=;{'totalCount': 3};Is it possible to make git autocompltion work like in bash?;2019-01-17T06:10:25Z;2019-01-20T16:54:59Z
7525;MDU6SXNzdWU0MDAyMTI4ODY=;{'totalCount': 4};Too long git branch names;2019-01-17T10:39:23Z;2019-01-21T13:29:09Z
7526;MDU6SXNzdWU0MDAyOTU1OTg=;{'totalCount': 12};Suggestions pushes prompt to right;2019-01-17T14:14:38Z;
7527;MDU6SXNzdWU0MDAzODEwMjQ=;{'totalCount': 1};"Remove the ""please"" alias to sudo";2019-01-17T17:20:58Z;2019-01-20T16:22:29Z
7528;MDU6SXNzdWU0MDA2MzkxNjI=;{'totalCount': 1};How about adding `gfu` as an alias for `git fetch upstream`;2019-01-18T09:24:35Z;2019-01-20T16:40:00Z
7529;MDU6SXNzdWU0MDA2NjMwMTU=;{'totalCount': 1};omz_history:fc:13: event not found;2019-01-18T10:26:13Z;2019-01-20T15:27:45Z
7530;MDU6SXNzdWU0MDA3MjE4NTQ=;{'totalCount': 2};/etc/passwd file permissions changed after execution of install.sh;2019-01-18T13:20:22Z;2019-01-20T16:05:40Z
7531;MDU6SXNzdWU0MDA3MjE4OTg=;{'totalCount': 14};No command 'your' found, did you mean:;2019-01-18T13:20:31Z;2019-01-31T13:48:07Z
7534;MDU6SXNzdWU0MDA5ODk2MzM=;{'totalCount': 1};vim , zsh ,zshrc ;2019-01-19T12:03:46Z;2019-03-24T10:17:48Z
7537;MDU6SXNzdWU0MDExNDMxNTU=;{'totalCount': 2};Clear git Prompt;2019-01-20T21:53:14Z;2019-04-09T18:14:40Z
7542;MDU6SXNzdWU0MDE5NDM5OTY=;{'totalCount': 4};misc.zsh (`\n') git.plugin.zsh (_omz_git_git_cmd^M);2019-01-22T20:39:15Z;2019-04-09T18:17:55Z
7543;MDU6SXNzdWU0MDIxMDM1NTE=;{'totalCount': 2};.zshrc custom installation : how to source it?;2019-01-23T07:21:49Z;2019-01-23T23:01:28Z
7545;MDU6SXNzdWU0MDIzODMxMTI=;{'totalCount': 1};Question: what is 'status'?;2019-01-23T18:56:54Z;2019-01-23T23:02:31Z
7549;MDU6SXNzdWU0MDMxMzI1MTA=;{'totalCount': 10};Line editing unusable near large directories;2019-01-25T12:12:17Z;
7550;MDU6SXNzdWU0MDMyMTE2MDE=;{'totalCount': 2};config globalias to expand not always;2019-01-25T15:45:31Z;2019-03-25T21:55:02Z
7551;MDU6SXNzdWU0MDMyMTY4NDA=;{'totalCount': 4};oh-my-zsh with tmux output unexpected  error ;2019-01-25T15:57:18Z;2019-01-31T15:56:19Z
7552;MDU6SXNzdWU0MDM0NDgyNjQ=;{'totalCount': 10};Slow shell;2019-01-26T14:45:23Z;2019-04-26T14:50:38Z
7553;MDU6SXNzdWU0MDM1NzU3ODE=;{'totalCount': 1};Failing on completing docker container names;2019-01-27T17:40:22Z;2019-01-30T15:20:54Z
7557;MDU6SXNzdWU0MDQwOTcyMDc=;{'totalCount': 2};"zsh mistakenly thinks unterminated quote when using exclamation mark (!"")";2019-01-29T02:42:34Z;2019-01-30T15:28:00Z
7558;MDU6SXNzdWU0MDQxNDMyMjY=;{'totalCount': 5};oh-my-zsh default ~/.zshrc will cause locale to be unset;2019-01-29T06:37:30Z;2019-04-09T18:22:46Z
7559;MDU6SXNzdWU0MDQyODA0ODU=;{'totalCount': 3};Issue with my prompt or my server;2019-01-29T13:01:53Z;2019-04-09T18:11:50Z
7560;MDU6SXNzdWU0MDQzNjM3NDg=;{'totalCount': 4};Does it support Windows?;2019-01-29T16:03:40Z;2019-01-30T15:26:25Z
7561;MDU6SXNzdWU0MDQ0NDE3Mzc=;{'totalCount': 1};New NordVPN Plugin;2019-01-29T19:06:24Z;
7562;MDU6SXNzdWU0MDQ0NjE0Njk=;{'totalCount': 1};transfer plugin: additional sign at end of transfer link;2019-01-29T19:57:52Z;2019-01-30T15:36:39Z
7563;MDU6SXNzdWU0MDQ3NzYyMDg=;{'totalCount': 2};Arrow and cross symbols disappeared from the prompt for Mac OS 10.14.4 beta;2019-01-30T13:42:13Z;2019-02-12T10:56:12Z
7565;MDU6SXNzdWU0MDUzMDgyMDY=;{'totalCount': 3};"Colored ""ls"" output in FreeBSD";2019-01-31T15:47:26Z;2019-04-22T19:11:14Z
7566;MDU6SXNzdWU0MDU1MDYxODE=;{'totalCount': 1};Updates spotify plugin to current master (as of 2019-01-31);2019-02-01T00:53:29Z;2019-02-01T00:56:06Z
7568;MDU6SXNzdWU0MDU1MjMwMDc=;{'totalCount': 0};autojump plugin checks wrong path in homebrew;2019-02-01T02:15:26Z;2019-04-09T17:49:25Z
7570;MDU6SXNzdWU0MDU2NTY1Njk=;{'totalCount': 2};Sublime plugin inconsistent readme and platform support;2019-02-01T11:11:36Z;2019-04-15T14:55:19Z
7572;MDU6SXNzdWU0MDU5MzgxOTY=;{'totalCount': 5};ggl giving error, temporarily fixed by commenting lines;2019-02-02T02:27:50Z;2019-02-11T18:05:04Z
7573;MDU6SXNzdWU0MDU5NTU0ODA=;{'totalCount': 2};When using iTerm, the colours don't get applied unless new tab is opened.;2019-02-02T06:49:52Z;2019-02-07T11:42:54Z
7575;MDU6SXNzdWU0MDYyNjExMjI=;{'totalCount': 7};ssh-agent plugin not working after update;2019-02-04T10:20:16Z;2019-02-06T10:45:12Z
7576;MDU6SXNzdWU0MDY1MzY5OTA=;{'totalCount': 0};g;2019-02-04T21:55:22Z;2019-02-04T21:56:49Z
7577;MDU6SXNzdWU0MDcwODc1NzQ=;{'totalCount': 3};Conditionally add to prompt only if envar is set;2019-02-06T05:35:55Z;2019-02-06T07:55:57Z
7579;MDU6SXNzdWU0MDcyMTc0NDE=;{'totalCount': 8};dotenv: make it possible to define the file you would like to use;2019-02-06T12:42:57Z;2019-05-19T20:45:27Z
7580;MDU6SXNzdWU0MDczMzMyNDI=;{'totalCount': 8};Prompted to enter SSH RSA key password twice when using ssh-agent plugin;2019-02-06T16:57:18Z;
7583;MDU6SXNzdWU0MDc2ODg5OTU=;{'totalCount': 2};no output after bad command when command-not-found plugin is enabled;2019-02-07T13:01:33Z;2019-02-09T09:36:59Z
7584;MDU6SXNzdWU0MDc3ODg2OTk=;{'totalCount': 0};Command not found for every command;2019-02-07T16:33:51Z;2019-02-07T16:46:28Z
7587;MDU6SXNzdWU0MDg1Njg0MTE=;{'totalCount': 0};Oh-my-zsh rpmostree plug-ins;2019-02-10T19:18:18Z;
7588;MDU6SXNzdWU0MDg3MTE2MDA=;{'totalCount': 10};Virtualenvwrapper conplains unnecesarily;2019-02-11T10:17:22Z;2019-05-13T21:55:27Z
7589;MDU6SXNzdWU0MDg3NTk0MDE=;{'totalCount': 4};ddev plugin? ;2019-02-11T12:28:22Z;2019-04-09T19:01:27Z
7590;MDU6SXNzdWU0MDg3OTI2NjI=;{'totalCount': 1};workon do not change python virtual environment;2019-02-11T13:55:21Z;2019-04-09T18:59:17Z
7591;MDU6SXNzdWU0MDk0Njg1ODc=;{'totalCount': 0};Refactor and unify mvn (Maven) plugin issues;2019-02-12T19:43:33Z;2019-02-17T20:11:07Z
7595;MDU6SXNzdWU0MTA5ODIwMjU=;{'totalCount': 7};Sublime plugin error;2019-02-15T23:02:21Z;2019-04-15T14:55:20Z
7596;MDU6SXNzdWU0MTEwODgzMjg=;{'totalCount': 1};"Completion with "". <TAB>"" should work like with ""source <TAB>""";2019-02-16T16:32:27Z;2019-02-17T13:11:36Z
7598;MDU6SXNzdWU0MTExOTIyNzg=;{'totalCount': 3};After installing oh-my-zsh on the server, cannot connect to this server by the software such as transmit or fillzila (macOS);2019-02-17T14:17:37Z;2019-03-24T10:17:24Z
7600;MDU6SXNzdWU0MTEyNDAxODc=;{'totalCount': 3};ssh-agent plugin always asks for passphrase after boot;2019-02-17T21:55:56Z;2019-02-18T19:16:49Z
7602;MDU6SXNzdWU0MTE0Mzc4OTM=;{'totalCount': 7};How to fix ohmyzsh startup error;2019-02-18T11:47:49Z;2019-03-23T16:55:55Z
7604;MDU6SXNzdWU0MTE1NjExOTA=;{'totalCount': 1};The aplay alias in ansible plugin overrides existing aplay command line sound recorder;2019-02-18T16:36:09Z;2019-02-25T13:40:52Z
7609;MDU6SXNzdWU0MTE5MDQ5Mzk=;{'totalCount': 1};Why don't Ctrl+Backspace and Ctrl+Delete work?;2019-02-19T12:42:36Z;
7610;MDU6SXNzdWU0MTE5MDcwNjA=;{'totalCount': 1};Vi mode breaks special characters ( Home, End, Delete, Backspace);2019-02-19T12:48:04Z;
7611;MDU6SXNzdWU0MTE5MjAxNjI=;{'totalCount': 1};_zsh_highlight_call_widget error after update;2019-02-19T13:20:46Z;2019-02-21T13:14:15Z
7618;MDU6SXNzdWU0MTM4NTI2MjU=;{'totalCount': 2};tab completes moves to wrong line;2019-02-24T18:34:21Z;2019-03-27T00:03:52Z
7623;MDU6SXNzdWU0MTU4Mzc0NTE=;{'totalCount': 0};Enable tmux window title updates when using proper tmux* $TERM values.;2019-02-28T21:44:17Z;2019-03-23T16:56:32Z
7627;MDU6SXNzdWU0MTY2NjUwODM=;{'totalCount': 2};What is the correct way to show some env var in PROMPT?;2019-03-04T07:25:41Z;2019-03-05T15:42:12Z
7628;MDU6SXNzdWU0MTY3MTU5ODY=;{'totalCount': 1};yarn completion invalid;2019-03-04T09:49:53Z;2019-04-09T21:04:13Z
7632;MDU6SXNzdWU0MTY5OTAxMzU=;{'totalCount': 4};Disable url escaping in quotes strings;2019-03-04T20:59:44Z;2019-05-11T11:50:32Z
7634;MDU6SXNzdWU0MTcyNDgxNDU=;{'totalCount': 1};Disable automatic shortening of hostnames;2019-03-05T11:20:17Z;2019-03-11T16:27:57Z
