number;id;comments;title;createdAt;closedAt
5132;MDU6SXNzdWUxNTc4MTYwMzk=;{'totalCount': 7};the output for django runserver will fail into sucks. it works ok in bash and zsh without oh-my-zsh.;2016-06-01T03:27:42Z;2016-09-06T02:07:11Z
5133;MDU6SXNzdWUxNTc4NjgwMTE=;{'totalCount': 4};zsh strange permission errors;2016-06-01T09:59:09Z;2018-09-24T12:24:55Z
5134;MDU6SXNzdWUxNTc4ODU5NTQ=;{'totalCount': 2};Fabric autocomplete plugin errors;2016-06-01T11:40:21Z;2016-08-12T14:08:43Z
5136;MDU6SXNzdWUxNTgxNzYwNzQ=;{'totalCount': 0};Up-arrow issue;2016-06-02T15:53:08Z;2016-06-06T17:24:35Z
5138;MDU6SXNzdWUxNTgzODQxNjc=;{'totalCount': 5};gcam alias question;2016-06-03T14:47:40Z;2016-06-03T15:34:47Z
5142;MDU6SXNzdWUxNTg2Mjc0NDA=;{'totalCount': 8};iTerm2 v3.0.0: syntax error: Expected “,” but found identifier;2016-06-06T08:43:08Z;2016-06-09T18:57:55Z
5145;MDU6SXNzdWUxNTg3OTM3MzA=;{'totalCount': 1};incorrect checksum for freed object - object was probably modified after being freed;2016-06-06T22:53:28Z;2018-06-18T20:38:40Z
5146;MDU6SXNzdWUxNTg3OTgzMzA=;{'totalCount': 1};no matches found: _vagrant[Conflict];2016-06-06T23:29:57Z;2018-06-18T20:36:56Z
5147;MDU6SXNzdWUxNTkxMDM1NTk=;{'totalCount': 2};Ubuntu 15.10 Problem: Changes to the directory after pressing the command.;2016-06-08T08:09:27Z;2016-06-08T10:31:34Z
5149;MDU6SXNzdWUxNTkyOTM3NjE=;{'totalCount': 2};Plugin 'safe-paste' messes with 'history-substring-search';2016-06-08T22:47:20Z;2016-07-20T21:16:37Z
5150;MDU6SXNzdWUxNTk0MDUyNDM=;{'totalCount': 5};SCP don't accept wildcard;2016-06-09T13:16:18Z;2016-06-09T13:32:33Z
5156;MDU6SXNzdWUxNjAwNTUxMzk=;{'totalCount': 1};Update issue;2016-06-13T22:02:11Z;2016-06-13T22:05:42Z
5157;MDU6SXNzdWUxNjAwODM0MjQ=;{'totalCount': 15};Completions on zsh repeat a command;2016-06-14T02:18:04Z;2016-06-14T23:27:38Z
5160;MDU6SXNzdWUxNjAzNjU5NDE=;{'totalCount': 2};Emacs plugin wrong keybinding;2016-06-15T08:30:28Z;2016-06-16T05:54:41Z
5161;MDU6SXNzdWUxNjA0MDI1Nzk=;{'totalCount': 2};After upgrade everything has broken up;2016-06-15T11:47:17Z;2016-06-15T12:00:30Z
5162;MDU6SXNzdWUxNjA0NTI3Nzk=;{'totalCount': 12};failed to load module `zsh/datetime';2016-06-15T15:32:25Z;
5168;MDU6SXNzdWUxNjA2NzE1NjA=;{'totalCount': 1};The git repo is corrupt;2016-06-16T14:11:22Z;2016-06-16T14:26:09Z
5170;MDU6SXNzdWUxNjA3NDEyNjA=;{'totalCount': 4};Taskwarrior completion fails due to regex arguments;2016-06-16T19:30:52Z;2016-06-17T09:43:08Z
5173;MDU6SXNzdWUxNjA5NDM1ODg=;{'totalCount': 1};`hash` for directory shortcuts broken after updating;2016-06-17T18:03:56Z;2016-06-20T19:27:07Z
5179;MDU6SXNzdWUxNjEyNzExNzA=;{'totalCount': 19};Update has broken auto-complete;2016-06-20T19:11:42Z;2016-06-21T19:40:38Z
5182;MDU6SXNzdWUxNjE0ODIxMzA=;{'totalCount': 1};custom/ not loading?;2016-06-21T16:27:22Z;2016-06-21T16:28:41Z
5184;MDU6SXNzdWUxNjE4NDE4OTU=;{'totalCount': 3};pj with two projects having the same name;2016-06-23T05:18:06Z;2016-08-11T00:12:46Z
5186;MDU6SXNzdWUxNjIxNDk2MTY=;{'totalCount': 0};Prefix/suffix names of virtualenv prompt info;2016-06-24T13:44:18Z;
5187;MDU6SXNzdWUxNjIzMjk4NDI=;{'totalCount': 2};Don't drop into ZSH in the installer;2016-06-26T14:21:52Z;2016-06-26T14:26:55Z
5192;MDU6SXNzdWUxNjI3MTc2MjY=;{'totalCount': 3};ys.zsh-theme virtualenv ;2016-06-28T15:38:28Z;2016-07-04T21:03:45Z
5193;MDU6SXNzdWUxNjMwODA2MDc=;{'totalCount': 1};Plugin, alias, function search engine;2016-06-30T04:53:37Z;2018-06-18T20:41:26Z
5196;MDU6SXNzdWUxNjMyMTQ4ODM=;{'totalCount': 3};nocorrect mv;2016-06-30T17:00:50Z;2017-07-07T04:39:30Z
5197;MDU6SXNzdWUxNjMzMTAwMTI=;{'totalCount': 1};How to integrate oh-my-zsh with other git tool - posh-git-bash to show git prompts?;2016-07-01T03:00:49Z;2018-06-12T21:19:39Z
5199;MDU6SXNzdWUxNjM0NTMyMTU=;{'totalCount': 18};Hashbang for zsh?;2016-07-01T18:45:24Z;2016-07-18T22:12:14Z
5200;MDU6SXNzdWUxNjM0OTA5OTg=;{'totalCount': 1};Alias on separet file;2016-07-01T23:49:58Z;2016-07-02T14:12:50Z
5203;MDU6SXNzdWUxNjM1NDA0NDQ=;{'totalCount': 6};Git plugin crashes after upgrading to El Capitan;2016-07-02T23:56:57Z;2016-07-11T18:55:56Z
5204;MDU6SXNzdWUxNjM1NTAwNDY=;{'totalCount': 2};_zsh_autosuggest_invoke_original_widget:7: maximum nested function level reached;2016-07-03T06:40:33Z;2016-07-05T02:07:10Z
5206;MDU6SXNzdWUxNjM2NTc0MTg=;{'totalCount': 7};Add a refreshing clock segment.;2016-07-04T11:27:39Z;2016-07-06T09:02:27Z
5208;MDU6SXNzdWUxNjM5MzIyMjk=;{'totalCount': 0};`display_info` command not found;2016-07-05T19:55:08Z;2018-06-18T20:49:56Z
5210;MDU6SXNzdWUxNjM5NjUzNDI=;{'totalCount': 3};Problem with vi-mode after changing $EDITOR variable;2016-07-05T23:02:25Z;2019-04-06T16:52:21Z
5212;MDU6SXNzdWUxNjQyMTIyMDc=;{'totalCount': 10};"I already add the ZSH_THEME=""agnoster"" in the zshrc but nothing happened why ";2016-07-07T01:49:12Z;2016-07-09T05:42:52Z
5213;MDU6SXNzdWUxNjQyNTQ0NDc=;{'totalCount': 5};`ctrl-r` stopped working after enabling `vi-mode`;2016-07-07T08:21:51Z;2016-07-19T16:31:41Z
5214;MDU6SXNzdWUxNjQzMDA3MjM=;{'totalCount': 5};gfa alias present both in go and git plugins;2016-07-07T12:47:32Z;2016-08-21T18:06:47Z
5216;MDU6SXNzdWUxNjQ2OTI4Mzk=;{'totalCount': 1};why I lost my zsh-autosuggestions and my oh-my-zsh is faiure;2016-07-10T00:45:31Z;2018-06-18T20:50:32Z
5217;MDU6SXNzdWUxNjQ3MTYxMDI=;{'totalCount': 0};Invoking hg while it is not present in Agnoster theme;2016-07-10T13:40:03Z;2016-07-22T13:04:35Z
5223;MDU6SXNzdWUxNjUwMzMzMzI=;{'totalCount': 2};Zsh is not installed! message is coming;2016-07-12T09:30:01Z;2016-07-14T12:58:50Z
5226;MDU6SXNzdWUxNjUzODY0MjY=;{'totalCount': 2};accidentally typed gsr with git plugin;2016-07-13T18:15:05Z;2016-07-15T16:21:55Z
5227;MDU6SXNzdWUxNjUzOTY2Mjc=;{'totalCount': 0};Tab completion not working;2016-07-13T19:02:05Z;2016-07-15T03:16:00Z
5228;MDU6SXNzdWUxNjU1NjQwOTU=;{'totalCount': 5};Help with application mode;2016-07-14T13:37:28Z;2016-07-15T15:35:21Z
5234;MDU6SXNzdWUxNjU5MDIxODg=;{'totalCount': 2};Why can't I see the emojis properly?;2016-07-16T01:29:14Z;2016-07-20T04:26:38Z
5236;MDU6SXNzdWUxNjU5MjM3NTc=;{'totalCount': 1};"""no matches found"" issue after today's update";2016-07-16T10:39:52Z;2016-07-16T20:47:31Z
5237;MDU6SXNzdWUxNjU5NDcyMjk=;{'totalCount': 3};Safe-paste plugin breaks Home/End keys;2016-07-16T20:57:27Z;
5241;MDU6SXNzdWUxNjY0Mjc3ODA=;{'totalCount': 3};Error with git.zsh:42;2016-07-19T20:29:10Z;2016-07-22T21:02:07Z
5243;MDU6SXNzdWUxNjY4MzM2Nzg=;{'totalCount': 8};omz_urlencode conflicts with alias from common_aliases;2016-07-21T14:30:33Z;2016-10-13T21:53:14Z
5244;MDU6SXNzdWUxNjY4NzU0Mjg=;{'totalCount': 0};smt theme git commit time wrong for new repo;2016-07-21T17:33:50Z;
5246;MDU6SXNzdWUxNjY5NDUwMDg=;{'totalCount': 0};Add plugin for cargo;2016-07-22T00:09:37Z;2016-10-03T22:20:03Z
5248;MDU6SXNzdWUxNjcxNzc5ODQ=;{'totalCount': 1};Strange display problem when inside git repos;2016-07-23T10:15:24Z;2019-04-05T16:35:38Z
5249;MDU6SXNzdWUxNjcyMTAyNDM=;{'totalCount': 2};af-magic improvment;2016-07-24T00:21:52Z;2019-04-06T17:07:46Z
5250;MDU6SXNzdWUxNjcyMTIyODU=;{'totalCount': 3};issue with git :cry:;2016-07-24T01:44:15Z;2016-08-05T13:01:33Z
5252;MDU6SXNzdWUxNjcyMzU5NjY=;{'totalCount': 1};Zsh features not working in Fedora 24;2016-07-24T14:27:18Z;2016-07-27T14:15:39Z
5254;MDU6SXNzdWUxNjc0NDgzMjQ=;{'totalCount': 1};zsh: command not found: z;2016-07-25T19:40:53Z;2016-08-05T13:02:16Z
5256;MDU6SXNzdWUxNjc1NDk5MzM=;{'totalCount': 5};zsh: command not found: git_prompt_info;2016-07-26T08:34:32Z;2016-08-11T00:43:17Z
5263;MDU6SXNzdWUxNjgyMzY4OTk=;{'totalCount': 1};docker 1.12;2016-07-29T02:17:55Z;2016-09-14T08:23:26Z
5266;MDU6SXNzdWUxNjg0ODU0NTY=;{'totalCount': 8};pj <tab> causes (eval):1: parse error near `&';2016-07-30T20:27:29Z;2016-08-16T15:34:13Z
5267;MDU6SXNzdWUxNjg0OTUzNjQ=;{'totalCount': 1};pj doesn't support project directories with spaces in them;2016-07-31T01:02:05Z;2016-08-16T15:34:13Z
5269;MDU6SXNzdWUxNjg1NjM2MzY=;{'totalCount': 1};zsh: command not found --- zsh cannot find any global packages;2016-08-01T04:20:44Z;2016-08-01T15:49:03Z
5270;MDU6SXNzdWUxNjg2Mjg2MjQ=;{'totalCount': 1};nvm functionality doesn't work if nvm is installed in a custom directory;2016-08-01T11:53:12Z;2016-08-07T17:36:44Z
5272;MDU6SXNzdWUxNjg4MTA2NzU=;{'totalCount': 3};oh-my-zsh.sh:42: parse error near `||';2016-08-02T06:40:44Z;2016-08-09T16:49:11Z
5273;MDU6SXNzdWUxNjg4MjYwODQ=;{'totalCount': 1};Feature request: RSpec plugin;2016-08-02T08:20:00Z;2018-06-18T20:52:04Z
5277;MDU6SXNzdWUxNjkwMjAyNTQ=;{'totalCount': 8};Install script set my shell to /usr/local/bin/zsh instead of /bin/zsh;2016-08-03T00:30:51Z;2019-06-03T15:25:57Z
5279;MDU6SXNzdWUxNjkxMTE3NjY=;{'totalCount': 5};oh-my-zsh cost 3-5 seconds to login;2016-08-03T11:42:23Z;2016-08-03T12:04:38Z
5284;MDU6SXNzdWUxNjk0MTI3NzA=;{'totalCount': 1};pj will report files as projects for autocomplete;2016-08-04T16:09:16Z;2016-08-16T15:34:13Z
5286;MDU6SXNzdWUxNjk3OTE3MDU=;{'totalCount': 5};Alternative to auto-update prompt;2016-08-07T11:17:16Z;
5288;MDU6SXNzdWUxNjk4ODM5MzA=;{'totalCount': 2};golang and git plugin alias conflict;2016-08-08T09:50:42Z;2016-08-11T00:36:53Z
5292;MDU6SXNzdWUxNzAwODcyMzk=;{'totalCount': 23};can't use tab-completion with Yoink Mac app;2016-08-09T05:49:16Z;2016-08-11T23:06:30Z
5293;MDU6SXNzdWUxNzAwOTA2MTk=;{'totalCount': 3};How ssh autocomplete hosts list is being generated?;2016-08-09T06:21:03Z;2019-04-07T18:34:09Z
5294;MDU6SXNzdWUxNzA0NTY0MzI=;{'totalCount': 4};NetBSD says zsh not installed on SDF;2016-08-10T16:09:50Z;2018-05-05T19:19:44Z
5295;MDU6SXNzdWUxNzA0NjM3MTE=;{'totalCount': 4};zsh update gave me a parse_git_dirty error;2016-08-10T16:43:28Z;2016-08-17T20:41:15Z
5297;MDU6SXNzdWUxNzA1NTUxMzM=;{'totalCount': 4};how to Remove random theme loaded text?;2016-08-11T01:36:15Z;2016-08-11T15:11:39Z
5300;MDU6SXNzdWUxNzA5OTc1NTY=;{'totalCount': 3};zsh: parse error near `|';2016-08-13T07:23:41Z;2016-08-13T20:09:38Z
5301;MDU6SXNzdWUxNzEwMzgzMjM=;{'totalCount': 4};Bash for Windows and wrong home/end/del;2016-08-14T02:27:38Z;2016-08-29T19:22:36Z
5302;MDU6SXNzdWUxNzEwNDMwNTk=;{'totalCount': 4};Completion feature hides the content;2016-08-14T05:22:12Z;2016-10-13T22:13:30Z
5303;MDU6SXNzdWUxNzEwNjU2MTk=;{'totalCount': 3};Autocomplete doesn't work with Java;2016-08-14T16:07:43Z;2016-08-22T09:34:53Z
5305;MDU6SXNzdWUxNzEwOTk1ODg=;{'totalCount': 4};^ symbol not recognized with zsh shell.-;2016-08-15T02:52:43Z;2016-08-15T20:19:01Z
5309;MDU6SXNzdWUxNzEyNzEzOTk=;{'totalCount': 5};Agnoster theme doesn't work on konsole;2016-08-15T21:55:50Z;2016-09-04T21:56:44Z
5310;MDU6SXNzdWUxNzEzNjM4Mjg=;{'totalCount': 2};go tool pprof autocomplete plugin errors;2016-08-16T09:26:32Z;2016-08-16T15:53:46Z
5311;MDU6SXNzdWUxNzEzNjk3MDM=;{'totalCount': 5};Oh My Zsh not enabled when doing `su` (root);2016-08-16T09:55:44Z;2016-08-16T13:47:46Z
5312;MDU6SXNzdWUxNzE0ODA5Mjc=;{'totalCount': 2};Dual prompt;2016-08-16T18:08:02Z;2016-08-17T07:55:00Z
5313;MDU6SXNzdWUxNzE1MTY3MDc=;{'totalCount': 3};gh alias is used by NodeGH tool;2016-08-16T21:00:23Z;2016-08-20T21:53:52Z
5315;MDU6SXNzdWUxNzE3OTQ2NDY=;{'totalCount': 7};Question about sourced files;2016-08-18T00:59:58Z;2016-08-21T01:38:23Z
5321;MDU6SXNzdWUxNzIwNjY2OTA=;{'totalCount': 10};git:10: command not found: gh;2016-08-19T06:56:02Z;2016-08-19T12:37:59Z
5323;MDU6SXNzdWUxNzIxNzY5ODM=;{'totalCount': 1};pj plugin improvement;2016-08-19T17:07:39Z;2016-08-20T22:11:26Z
5324;MDU6SXNzdWUxNzIyMDE3MjU=;{'totalCount': 0};r;2016-08-19T19:19:42Z;2016-08-19T19:20:59Z
5325;MDU6SXNzdWUxNzIyMzk4OTI=;{'totalCount': 6};Autocomplete not working correctly with filenames containing spaces;2016-08-19T23:44:32Z;2017-11-01T13:01:40Z
5327;MDU6SXNzdWUxNzIyODQ5NDc=;{'totalCount': 68};oh-my-zsh very slow :(;2016-08-20T18:48:54Z;2017-11-01T12:59:57Z
5330;MDU6SXNzdWUxNzIzMjkxMDQ=;{'totalCount': 0};~;2016-08-21T16:41:14Z;2016-08-21T16:54:26Z
5331;MDU6SXNzdWUxNzI0MTA0NTk=;{'totalCount': 2};REPORTTIME;2016-08-22T09:48:21Z;2016-09-20T05:30:36Z
5332;MDU6SXNzdWUxNzI2MDkyMTI=;{'totalCount': 10};npm.plugin.zsh:4: command not found: npm;2016-08-23T04:19:02Z;2016-09-09T22:26:20Z
5333;MDU6SXNzdWUxNzI4NTU1ODA=;{'totalCount': 1};Wrong URL;2016-08-24T03:17:17Z;2016-08-24T06:56:51Z
5334;MDU6SXNzdWUxNzI4NzYzMjk=;{'totalCount': 1};tgucnthgflkdg;2016-08-24T06:43:38Z;2016-08-24T06:43:45Z
5337;MDU6SXNzdWUxNzI5NzAyOTM=;{'totalCount': 0};pip plugin - completion is outdated;2016-08-24T14:41:05Z;2016-09-28T19:28:54Z
5340;MDU6SXNzdWUxNzMwOTIxNDc=;{'totalCount': 8};Autocomplete the last word still here;2016-08-25T01:01:13Z;2016-10-13T22:05:06Z
5342;MDU6SXNzdWUxNzMxODc4MDI=;{'totalCount': 2};candy-kingdom theme hg prompt error.;2016-08-25T12:18:23Z;2020-02-11T16:45:19Z
5345;MDU6SXNzdWUxNzMzNjU3MTM=;{'totalCount': 3};display problem when I type more than one line;2016-08-26T04:02:22Z;2016-10-03T11:18:32Z
5349;MDU6SXNzdWUxNzM1Njg3MjQ=;{'totalCount': 10};ls colors not displayed;2016-08-27T00:47:30Z;2016-09-12T15:43:36Z
5351;MDU6SXNzdWUxNzM3NDE0NTI=;{'totalCount': 9};complete:13: command not found: compdef;2016-08-29T10:11:27Z;2016-08-30T10:06:31Z
5353;MDU6SXNzdWUxNzM5MzU0NzE=;{'totalCount': 1};wget Install Fail : Certification Error;2016-08-30T05:51:35Z;2016-08-30T08:11:20Z
5355;MDU6SXNzdWUxNzQwNTkwMDk=;{'totalCount': 0};Git commits ahead shows 0 commits;2016-08-30T16:01:27Z;2016-09-05T09:26:05Z
5357;MDU6SXNzdWUxNzQyNTk0MTk=;{'totalCount': 1};How to enable postgres plugin;2016-08-31T12:23:58Z;2016-09-12T15:42:48Z
5360;MDU6SXNzdWUxNzQzNDk4MTA=;{'totalCount': 1};i get ??? instead of default red arrow.. ;2016-08-31T18:53:03Z;2016-09-01T19:40:05Z
5362;MDU6SXNzdWUxNzQ1NzMyNzc=;{'totalCount': 0};git plugin;2016-09-01T16:51:24Z;2016-09-05T08:57:28Z
5364;MDU6SXNzdWUxNzQ2NjQzMTE=;{'totalCount': 1};custom plugin auto run when shell start;2016-09-02T01:54:14Z;2016-09-04T17:10:35Z
5365;MDU6SXNzdWUxNzQ2NzA2Mjk=;{'totalCount': 1};Image for awesomepanda theme to be used with wiki;2016-09-02T03:01:34Z;2016-09-02T18:15:52Z
5366;MDU6SXNzdWUxNzQ3MTI2NDg=;{'totalCount': 1};Windows subsystem for Linux: .oh-my-zsh/oh-my-zsh.sh:42: parse error near `||';2016-09-02T09:00:58Z;2016-09-03T18:28:47Z
5368;MDU6SXNzdWUxNzQ3Nzk3MDA=;{'totalCount': 10};Task completion crashes on zsh 5.0.2 and task 2.5.1;2016-09-02T14:57:53Z;2016-09-08T21:16:18Z
5370;MDU6SXNzdWUxNzQ4ODMwMDc=;{'totalCount': 2};Django plugin is not listed in Plugins wiki;2016-09-03T06:50:03Z;2016-09-03T17:58:19Z
5371;MDU6SXNzdWUxNzQ4OTQ4OTE=;{'totalCount': 4};cat {file1,file2} > file3;2016-09-03T12:37:57Z;2016-09-03T18:27:42Z
5375;MDU6SXNzdWUxNzUwODEyNDA=;{'totalCount': 1};Support pycharm embedded terminal - osx plugin;2016-09-05T14:19:31Z;2016-09-05T17:54:06Z
5378;MDU6SXNzdWUxNzUyMDQ3ODg=;{'totalCount': 1};display not normal!;2016-09-06T09:47:16Z;2016-09-11T15:29:09Z
5379;MDU6SXNzdWUxNzUyMDcxMTA=;{'totalCount': 2};"how can I remove "" master ●"" label";2016-09-06T09:58:35Z;2016-09-11T15:27:20Z
5387;MDU6SXNzdWUxNzU1NjQ1NjM=;{'totalCount': 3};themes not displayed properly when becoming root;2016-09-07T17:45:10Z;2016-09-11T15:25:42Z
5391;MDU6SXNzdWUxNzU5NzA2ODc=;{'totalCount': 3};zsh: command not found: brew Mac El Capitan;2016-09-09T09:49:31Z;2016-10-13T21:58:22Z
5392;MDU6SXNzdWUxNzYxODcwMjM=;{'totalCount': 3};"plugin:""last-working-dir"" conflict with ""open babun here"" context menu";2016-09-10T16:04:57Z;2016-09-30T18:11:17Z
5393;MDU6SXNzdWUxNzYyMTE4MTU=;{'totalCount': 2};/Users/ssteiner/.zshrc:15: command not found: antigen;2016-09-11T00:20:03Z;2016-09-11T15:42:24Z
5394;MDU6SXNzdWUxNzYyNDE4MjU=;{'totalCount': 1};how to add a function to git.plugin.zsh;2016-09-11T12:38:21Z;2016-09-11T15:02:11Z
5397;MDU6SXNzdWUxNzYyNTcxMzY=;{'totalCount': 0};.zshrc;2016-09-11T18:25:18Z;2016-09-11T19:31:53Z
5398;MDU6SXNzdWUxNzYyNTcxMzc=;{'totalCount': 0};.zshrc;2016-09-11T18:25:19Z;2016-09-11T19:31:25Z
5399;MDU6SXNzdWUxNzYyNTcyMTE=;{'totalCount': 1};.zshrc;2016-09-11T18:26:28Z;2016-09-11T19:32:42Z
5400;MDU6SXNzdWUxNzYyNTg2OTQ=;{'totalCount': 12};Error displayed when coreutils is in the path ;2016-09-11T18:55:47Z;2016-09-12T17:00:01Z
5401;MDU6SXNzdWUxNzYyNjExMTk=;{'totalCount': 18};zsh as default shell;2016-09-11T19:41:20Z;2016-09-30T11:41:18Z
5403;MDU6SXNzdWUxNzYzMTc2ODU=;{'totalCount': 3};ZNT History widget not working after update;2016-09-12T08:14:40Z;2016-09-12T14:06:11Z
5404;MDU6SXNzdWUxNzYzODk5ODg=;{'totalCount': 2};Getting a Parse error after update. ;2016-09-12T14:29:04Z;2016-09-12T14:46:22Z
5405;MDU6SXNzdWUxNzYzOTg3Njg=;{'totalCount': 8};Opening files with emacsclient, creates a second frame...;2016-09-12T15:00:37Z;
5406;MDU6SXNzdWUxNzY1MTkzMTQ=;{'totalCount': 3};ssh-agent not forwarded on OS X;2016-09-13T00:33:45Z;2017-02-24T22:46:17Z
5407;MDU6SXNzdWUxNzY1MzAyMDY=;{'totalCount': 1};Autocomplete doesn't recognize filename with number after dot;2016-09-13T02:07:26Z;2016-09-13T08:41:45Z
5408;MDU6SXNzdWUxNzY1NzA5ODQ=;{'totalCount': 1};docker-compose aliases;2016-09-13T07:35:33Z;2016-09-14T07:49:50Z
5409;MDU6SXNzdWUxNzY1NzE2NTQ=;{'totalCount': 2};zsh: can't open input file: /tools/check_for_upgrade.sh;2016-09-13T07:39:18Z;2016-09-23T06:19:27Z
5410;MDU6SXNzdWUxNzY2NzQ1OTE=;{'totalCount': 3};bindkey -v breaks arrows;2016-09-13T15:37:11Z;2018-06-14T18:27:47Z
5411;MDU6SXNzdWUxNzY4MzY4NjU=;{'totalCount': 7};docker completion arguments for a command;2016-09-14T07:40:47Z;2016-09-14T07:58:28Z
5414;MDU6SXNzdWUxNzcxMTQwNjg=;{'totalCount': 1};Blinks theme: Add time above current history event number;2016-09-15T08:04:20Z;2019-04-05T16:09:36Z
5416;MDU6SXNzdWUxNzczOTkzNTU=;{'totalCount': 2};oh-my-zsh Taking too much time while login;2016-09-16T11:03:03Z;2018-06-20T21:20:30Z
5418;MDU6SXNzdWUxNzc1NDU2NTQ=;{'totalCount': 0};ssh-agent plugin is broken under Cygwin/MSYS2;2016-09-17T00:36:44Z;2016-09-17T11:03:40Z
5419;MDU6SXNzdWUxNzc2OTE5NjM=;{'totalCount': 2};where should i put my aliases;2016-09-19T01:50:21Z;2016-09-19T16:29:16Z
5420;MDU6SXNzdWUxNzc3NDU1NDM=;{'totalCount': 2};cp plugin cpv has not path autocompletion;2016-09-19T10:00:33Z;2016-10-03T23:03:16Z
5421;MDU6SXNzdWUxNzc5ODI3NzQ=;{'totalCount': 1};gulp -v display bug;2016-09-20T07:12:35Z;2016-09-20T18:32:45Z
5424;MDU6SXNzdWUxNzgwMTcyODM=;{'totalCount': 4};cd auto-completion of .. fails with parentheses in directory name;2016-09-20T09:59:53Z;2016-09-21T06:09:47Z
5428;MDU6SXNzdWUxNzgxNzU4OTY=;{'totalCount': 3};Issue with todays update - zsh-syntax-highlighting;2016-09-20T20:47:12Z;2016-10-03T22:20:44Z
5436;MDU6SXNzdWUxNzg1NzY2NDU=;{'totalCount': 2};Tab autocompletion for files breaks with some extensions;2016-09-22T10:47:38Z;2016-09-22T13:30:37Z
5437;MDU6SXNzdWUxNzg1OTcxMTY=;{'totalCount': 6};Tab auto-completion hangs the terminal (macOS Sierra);2016-09-22T12:30:30Z;2016-09-22T13:27:52Z
5438;MDU6SXNzdWUxNzg2MTQxMzU=;{'totalCount': 8};Hello! I've updated Mac OS Sierra, but can not be used iTerm;2016-09-22T13:45:50Z;2017-11-01T13:01:25Z
5441;MDU6SXNzdWUxNzg4MTM2NjE=;{'totalCount': 1};agnoster theme: bzr;2016-09-23T08:19:32Z;2016-09-23T15:47:18Z
5442;MDU6SXNzdWUxNzg4MzE3MjI=;{'totalCount': 15};"""compdef: unknown command or service: git"" and tab completion broken";2016-09-23T09:44:01Z;2016-11-09T12:06:41Z
5444;MDU6SXNzdWUxNzkwMTk5MTE=;{'totalCount': 17};"Themes do not work on ""Bash on Ubuntu on Windows""";2016-09-24T08:54:55Z;2016-12-18T03:55:54Z
5445;MDU6SXNzdWUxNzkwMjQ4NTI=;{'totalCount': 15};Current path is not displayed with Sierra;2016-09-24T11:03:34Z;2016-09-24T18:56:28Z
5446;MDU6SXNzdWUxNzkwNTM4NDY=;{'totalCount': 4};Uninstall instructions don't work out of the box;2016-09-24T21:46:17Z;2018-06-12T22:35:52Z
5447;MDU6SXNzdWUxNzkwNTUyODA=;{'totalCount': 0};g;2016-09-24T22:20:17Z;2016-09-24T22:20:25Z
5449;MDU6SXNzdWUxNzkxMDU2NzQ=;{'totalCount': 3};PERL environment variable are lost;2016-09-25T20:01:12Z;2016-09-28T15:41:31Z
5450;MDU6SXNzdWUxNzkxMDg0Nzk=;{'totalCount': 3};last-working-dir plug-in causes unexpected behavior in Emacs;2016-09-25T20:56:57Z;2016-09-30T18:11:17Z
5453;MDU6SXNzdWUxNzkyNjc1NjU=;{'totalCount': 2};nvm plugin reloads existing nvm;2016-09-26T15:54:39Z;2019-04-08T15:58:28Z
5455;MDU6SXNzdWUxNzkzMDg2NDA=;{'totalCount': 5};[Documentation] ZSH without Oh-My-Zsh;2016-09-26T18:54:04Z;2016-09-28T20:37:12Z
5458;MDU6SXNzdWUxNzkzNTQwMDY=;{'totalCount': 4};"keybindings change when exiting zsh (ssh session) via ctrl-d, but not via ""exit""";2016-09-26T22:34:10Z;2016-10-03T22:30:11Z
5459;MDU6SXNzdWUxNzkzOTAxNDE=;{'totalCount': 2};How to disable auto selected mode after paste;2016-09-27T03:37:27Z;2016-09-28T15:45:50Z
5465;MDU6SXNzdWUxNzk1MjI0NTI=;{'totalCount': 0};"add signing at git commit -m ""message"" on plugin";2016-09-27T15:12:39Z;2016-10-02T23:11:26Z
5466;MDU6SXNzdWUxNzk1NDgyNzQ=;{'totalCount': 10};Backticks and $() evaluated twice;2016-09-27T16:44:15Z;2016-09-27T19:30:08Z
5468;MDU6SXNzdWUxNzk2NTI0NDM=;{'totalCount': 5};trapd00r theme has external dependency;2016-09-28T00:37:58Z;2018-08-19T20:43:48Z
5469;MDU6SXNzdWUxNzk3Mjc0Nzk=;{'totalCount': 2};Syntax highlighting very verbose, after update in Sierra OSX;2016-09-28T09:48:51Z;2016-09-28T12:32:11Z
5470;MDU6SXNzdWUxNzk3NTA3OTY=;{'totalCount': 2};Completion no longer works for directories containing hyphens;2016-09-28T11:48:06Z;2016-09-28T12:42:41Z
5473;MDU6SXNzdWUxNzk4NzI5MTY=;{'totalCount': 1};tmux plugin causes hanging tmux sessions;2016-09-28T19:58:28Z;2019-04-05T16:13:50Z
5478;MDU6SXNzdWUxODAxMzcwNDU=;{'totalCount': 5};Default theme [robbyrussell] broken after updating to OS Sierra;2016-09-29T19:14:28Z;2016-10-01T20:09:31Z
5479;MDU6SXNzdWUxODAyMzExMjA=;{'totalCount': 14};agnoster theme - only show ~ as working directory;2016-09-30T06:38:04Z;2016-09-30T17:51:45Z
5482;MDU6SXNzdWUxODAzNDI2MDU=;{'totalCount': 4};emotty theme + emotty plugin + oh-my-zsh.sh = ☠;2016-09-30T16:08:44Z;2018-04-15T13:21:01Z
5484;MDU6SXNzdWUxODA0MjIzNzE=;{'totalCount': 0};root does not work with theme;2016-09-30T23:31:06Z;2016-09-30T23:40:31Z
5485;MDU6SXNzdWUxODA0MzUzMDQ=;{'totalCount': 1};my vim setting files are removed after auto update.;2016-10-01T03:28:33Z;2016-10-01T08:16:50Z
5486;MDU6SXNzdWUxODA0NzY2NTA=;{'totalCount': 17};git_prompt_status is slow on cygwin;2016-10-01T19:58:30Z;
5487;MDU6SXNzdWUxODA1MTU2ODA=;{'totalCount': 2};Agnoster theme looks weird ;2016-10-02T14:45:56Z;2016-10-02T18:25:54Z
5490;MDU6SXNzdWUxODA3NjEwMjU=;{'totalCount': 5};<cmd>:<num>: command not found: <expr>;2016-10-03T22:15:51Z;2016-10-03T22:59:41Z
5492;MDU6SXNzdWUxODA4NDA1OTk=;{'totalCount': 2};per-directory-history plugin;2016-10-04T09:06:55Z;2016-10-04T11:56:25Z
5494;MDU6SXNzdWUxODA4ODgzNzM=;{'totalCount': 1};autoenv should work with locally installed package;2016-10-04T13:09:20Z;2018-09-03T14:13:21Z
5495;MDU6SXNzdWUxODA5NjI2Nzc=;{'totalCount': 1};docker-machine autocomplete causes error;2016-10-04T18:01:12Z;2018-06-12T21:21:53Z
5499;MDU6SXNzdWUxODE1NjI1NjU=;{'totalCount': 8};bracketd-paste-magic always escapes in 5.2 (Mac OSX 10.12) and 5.3 (Mac OSX 10.13);2016-10-07T01:15:11Z;2019-05-11T11:50:31Z
5505;MDU6SXNzdWUxODE4MzU0NjU=;{'totalCount': 1};auto completion only works with directories?;2016-10-08T16:37:40Z;2016-10-09T15:53:44Z
5507;MDU6SXNzdWUxODE4NzgyNDc=;{'totalCount': 3};Auto git fetch when cd into a git repo;2016-10-09T09:56:59Z;2019-04-05T16:16:14Z
5512;MDU6SXNzdWUxODE5NTU1MjA=;{'totalCount': 5};info: how I can hide the pc name and full actual directory route;2016-10-10T08:00:49Z;2016-10-10T19:50:27Z
5513;MDU6SXNzdWUxODE5NjcwODg=;{'totalCount': 3};Can add some autocomplete respect the project podfile for the zsh plugin?;2016-10-10T09:07:27Z;2017-11-05T06:45:53Z
5514;MDU6SXNzdWUxODIwMDE3NDA=;{'totalCount': 1};suvash theme is not being applied;2016-10-10T12:24:01Z;2016-10-13T22:25:45Z
5515;MDU6SXNzdWUxODIwMjU0MDk=;{'totalCount': 2};alias (caching) question;2016-10-10T14:14:00Z;2016-10-10T14:36:23Z
5520;MDU6SXNzdWUxODIxNjAxNzM=;{'totalCount': 8};folder and files colour issue;2016-10-11T02:42:15Z;2016-10-11T07:26:26Z
5521;MDU6SXNzdWUxODIyMDgzNTI=;{'totalCount': 4};Why some zsh related projects isn't incorporated into oh-my-zsh;2016-10-11T08:49:47Z;2016-10-13T22:18:05Z
5523;MDU6SXNzdWUxODIzNDEwMTc=;{'totalCount': 0};Help with History and command logging in Zsh;2016-10-11T18:38:59Z;2016-10-11T18:52:22Z
5525;MDU6SXNzdWUxODI0OTc3MTg=;{'totalCount': 1};when I login，show sth wrong;2016-10-12T11:06:44Z;2016-10-13T22:00:21Z
5532;MDU6SXNzdWUxODI5NTkzNDI=;{'totalCount': 3};"(venv) upon activating virtualenv doesn't show up in ""robbyrussell"" theme";2016-10-14T04:09:35Z;2017-08-13T19:07:31Z
5534;MDU6SXNzdWUxODMwMTc0NTg=;{'totalCount': 3};Many plug-ins can not be used after .zshrc addition, various methods will not work.;2016-10-14T10:33:23Z;2016-10-20T01:38:35Z
5535;MDU6SXNzdWUxODMwMjU3Mjc=;{'totalCount': 1};New Feature : add a simple command to check which are not merged to current git branch;2016-10-14T11:20:09Z;2019-04-05T16:29:26Z
5539;MDU6SXNzdWUxODMyMDYxODU=;{'totalCount': 1};Completion knife data bag from file doesn't complete path;2016-10-15T12:04:42Z;2019-04-05T16:35:09Z
5543;MDU6SXNzdWUxODMzMTk5NTY=;{'totalCount': 12};nvm is broken after I installing oh-my-zsh?;2016-10-17T03:52:16Z;2018-05-17T19:07:45Z
5546;MDU6SXNzdWUxODM1MjQxMzU=;{'totalCount': 6};Odd display bug with Agnoster theme, user root only;2016-10-17T20:51:15Z;2018-09-24T12:18:26Z
5547;MDU6SXNzdWUxODM1NDEyNDU=;{'totalCount': 1};Fuzzy Expansion no longer working;2016-10-17T22:07:50Z;2016-10-30T00:31:16Z
5549;MDU6SXNzdWUxODM3Nzc0MzY=;{'totalCount': 4};"Wrong indentation because ""high voltage sign""  began to have a size of two signs";2016-10-18T19:15:01Z;2017-01-22T13:19:26Z
5551;MDU6SXNzdWUxODQwMDAwMTE=;{'totalCount': 1};How do i install this please help ;2016-10-19T15:44:49Z;2016-10-19T15:54:25Z
5552;MDU6SXNzdWUxODQwNDgzNDQ=;{'totalCount': 9};Color ls broken after update;2016-10-19T19:08:45Z;2016-11-02T14:39:29Z
5553;MDU6SXNzdWUxODQwNjI5MzA=;{'totalCount': 2};trying to modify bureau theme to include IP, but it puts time on new line.;2016-10-19T20:16:34Z;2016-10-25T04:27:55Z
5556;MDU6SXNzdWUxODQyMzExNzY=;{'totalCount': 3};My custom oh-my-zsh theme;2016-10-20T13:34:59Z;2016-10-25T04:21:40Z
